"Enrichment FDR","Genes in list","Total genes","Functional Category","Genes"
6.49623714821249e-20,618,3092,"Cellular protein modification process ","AT1G01540 AT1G01940 AT1G02145 AT1G03740 AT1G04210 AT1G04860 AT1G05170 AT1G08590 AT1G08750 AT1G10600 AT1G12400 AT1G12680 AT1G13460 AT1G14200 AT1G15570 AT1G16570 AT1G17110 AT1G18040 AT1G18340 AT1G20540 AT1G20610 AT1G20930 AT1G24190 AT1G24610 AT1G27630 AT1G28440 AT1G32930 AT1G47230 AT1G48210 AT1G49580 AT1G51170 AT1G52310 AT1G52540 AT1G53050 AT1G53165 AT1G53280 AT1G53290 AT1G53570 AT1G53710 AT1G53720 AT1G54140 AT1G55530 AT1G55860 AT1G56720 AT1G57820 AT1G60490 AT1G60800 AT1G63700 AT1G65040 AT1G65430 AT1G65650 AT1G66750 AT1G67580 AT1G69420 AT1G70060 AT1G70210 AT1G70530 AT1G71230 AT1G71830 AT1G72310 AT1G73820 AT1G76260 AT1G76310 AT1G78800 AT2G01820 AT2G02560 AT2G04550 AT2G11520 AT2G14255 AT2G16530 AT2G17620 AT2G19470 AT2G19670 AT2G21130 AT2G21470 AT2G22310 AT2G23950 AT2G24640 AT2G25740 AT2G25790 AT2G26430 AT2G26700 AT2G27350 AT2G28250 AT2G30880 AT2G31305 AT2G31510 AT2G32850 AT2G34650 AT2G35320 AT2G35620 AT2G36350 AT2G37840 AT2G38620 AT2G39720 AT2G40190 AT2G40830 AT2G41140 AT2G41490 AT2G41760 AT2G41890 AT2G43080 AT2G44660 AT2G44830 AT2G48010 AT2G48030 AT3G01380 AT3G02070 AT3G03550 AT3G04240 AT3G04480 AT3G05050 AT3G05090 AT3G06440 AT3G06820 AT3G06930 AT3G08720 AT3G08850 AT3G10540 AT3G11520 AT3G12270 AT3G13430 AT3G14400 AT3G14960 AT3G17205 AT3G17420 AT3G17510 AT3G17850 AT3G20020 AT3G20830 AT3G21220 AT3G23750 AT3G26020 AT3G28480 AT3G28970 AT3G29160 AT3G44600 AT3G44680 AT3G45630 AT3G45780 AT3G46460 AT3G48070 AT3G49590 AT3G50920 AT3G51390 AT3G51630 AT3G51850 AT3G54010 AT3G54130 AT3G54180 AT3G56930 AT3G59110 AT3G60800 AT3G61420 AT3G62770 AT4G00840 AT4G00990 AT4G01026 AT4G01730 AT4G03390 AT4G04700 AT4G04720 AT4G05200 AT4G10050 AT4G10730 AT4G11860 AT4G14350 AT4G14580 AT4G15080 AT4G15415 AT4G15880 AT4G16420 AT4G18230 AT4G19670 AT4G20270 AT4G21410 AT4G22305 AT4G23270 AT4G24100 AT4G24490 AT4G24560 AT4G24630 AT4G24940 AT4G26100 AT4G26400 AT4G28980 AT4G29940 AT4G30790 AT4G34370 AT4G35620 AT4G35905 AT4G36390 AT4G38230 AT4G38240 AT4G39270 AT5G02310 AT5G02800 AT5G03330 AT5G03470 AT5G04250 AT5G05460 AT5G05700 AT5G06460 AT5G06830 AT5G08415 AT5G10270 AT5G13160 AT5G14260 AT5G14530 AT5G15400 AT5G16000 AT5G16710 AT5G16800 AT5G17070 AT5G18190 AT5G18940 AT5G19130 AT5G20050 AT5G20990 AT5G23400 AT5G24430 AT5G25510 AT5G28080 AT5G28850 AT5G28900 AT5G37055 AT5G38460 AT5G38560 AT5G40030 AT5G40250 AT5G40280 AT5G44090 AT5G44100 AT5G44290 AT5G45190 AT5G47540 AT5G48630 AT5G48640 AT5G50020 AT5G53340 AT5G54380 AT5G54590 AT5G55170 AT5G56340 AT5G56580 AT5G56890 AT5G57015 AT5G57630 AT5G58350 AT5G58450 AT5G58575 AT5G60170 AT5G63110 AT5G63610 AT5G63760 AT5G63930 AT5G65530 AT5G66060 AT5G66850 AT5G66880 AT5G67530 AT5G67630 AT1G08490 AT1G08680 AT1G09020 AT1G49340 AT1G49780 AT1G63900 AT1G76710 AT1G77300 AT1G79810 AT2G01150 AT2G01210 AT2G25880 AT2G30360 AT2G31800 AT2G32710 AT2G39000 AT2G39660 AT2G39810 AT3G01650 AT3G05200 AT3G06483 AT3G06540 AT3G07370 AT3G09970 AT3G14980 AT3G18290 AT3G45240 AT3G47990 AT3G52450 AT3G55530 AT4G03415 AT4G08920 AT4G13160 AT4G14220 AT4G17410 AT4G18140 AT4G28650 AT4G31750 AT4G32660 AT5G03730 AT5G07270 AT5G11860 AT5G15120 AT5G20910 AT5G42200 AT5G45800 AT5G49665 AT5G55500 AT5G57050 AT5G64920 AT1G01640 AT1G02860 AT1G03430 AT1G03780 AT1G04790 AT1G04900 AT1G04910 AT1G05830 AT1G07630 AT1G08420 AT1G08460 AT1G08620 AT1G08710 AT1G10170 AT1G10210 AT1G10690 AT1G10850 AT1G12990 AT1G13690 AT1G14020 AT1G16270 AT1G16710 AT1G17550 AT1G18160 AT1G18390 AT1G20823 AT1G22510 AT1G23780 AT1G26830 AT1G26940 AT1G27190 AT1G27320 AT1G27440 AT1G27520 AT1G30000 AT1G30900 AT1G31420 AT1G32750 AT1G34130 AT1G34750 AT1G43690 AT1G43900 AT1G45050 AT1G47380 AT1G51590 AT1G51830 AT1G51940 AT1G53190 AT1G53510 AT1G53780 AT1G54150 AT1G55000 AT1G55900 AT1G61040 AT1G62330 AT1G63090 AT1G63170 AT1G63430 AT1G63500 AT1G63800 AT1G63850 AT1G64280 AT1G65410 AT1G66340 AT1G67340 AT1G68050 AT1G68410 AT1G69270 AT1G71410 AT1G72175 AT1G72770 AT1G73655 AT1G73670 AT1G77550 AT1G79000 AT1G79730 AT1G80290 AT1G80570 AT2G01735 AT2G01830 AT2G02220 AT2G05330 AT2G07180 AT2G14740 AT2G15580 AT2G16740 AT2G17020 AT2G17520 AT2G17530 AT2G17570 AT2G17930 AT2G18170 AT2G19430 AT2G20000 AT2G21950 AT2G23080 AT2G23380 AT2G23420 AT2G23450 AT2G24230 AT2G24240 AT2G24990 AT2G25710 AT2G26810 AT2G27210 AT2G28060 AT2G28890 AT2G30600 AT2G31880 AT2G32950 AT2G33580 AT2G33700 AT2G35910 AT2G38730 AT2G38950 AT2G39110 AT2G39445 AT2G39760 AT2G39940 AT2G40270 AT2G40730 AT2G40930 AT2G42030 AT2G42160 AT2G44270 AT2G45340 AT2G45950 AT2G46260 AT2G46340 AT2G46920 AT2G47860 AT3G01300 AT3G02340 AT3G02750 AT3G02800 AT3G02880 AT3G03810 AT3G04580 AT3G05870 AT3G06110 AT3G06190 AT3G06330 AT3G06670 AT3G08760 AT3G09100 AT3G09770 AT3G10810 AT3G12200 AT3G12340 AT3G12400 AT3G12620 AT3G12980 AT3G14720 AT3G15070 AT3G16720 AT3G16740 AT3G20740 AT3G21160 AT3G21640 AT3G22590 AT3G24660 AT3G24800 AT3G26000 AT3G27560 AT3G28700 AT3G29270 AT3G30300 AT3G44620 AT3G45100 AT3G46590 AT3G46820 AT3G47890 AT3G47910 AT3G48330 AT3G48430 AT3G48820 AT3G50780 AT3G51770 AT3G52280 AT3G53570 AT3G54350 AT3G55050 AT3G55450 AT3G55920 AT3G55960 AT3G56050 AT3G57170 AT3G57710 AT3G58130 AT3G58180 AT3G58530 AT3G59940 AT3G60080 AT3G60370 AT3G61990 AT3G62970 AT3G63260 AT4G00335 AT4G02405 AT4G02680 AT4G02740 AT4G06599 AT4G15180 AT4G16650 AT4G17070 AT4G18950 AT4G19660 AT4G20110 AT4G21510 AT4G22285 AT4G23050 AT4G23740 AT4G23860 AT4G24390 AT4G26430 AT4G27800 AT4G28400 AT4G30820 AT4G30860 AT4G31100 AT4G31110 AT4G33210 AT4G33920 AT4G33940 AT4G34100 AT4G35600 AT4G35910 AT4G37880 AT5G01520 AT5G01530 AT5G01720 AT5G01820 AT5G01830 AT5G01850 AT5G01950 AT5G02290 AT5G02410 AT5G03200 AT5G04540 AT5G04670 AT5G04940 AT5G05660 AT5G06750 AT5G10020 AT5G10650 AT5G10930 AT5G14210 AT5G14420 AT5G15080 AT5G16480 AT5G19000 AT5G19280 AT5G21326 AT5G22030 AT5G22840 AT5G24100 AT5G24270 AT5G27420 AT5G33290 AT5G35100 AT5G35570 AT5G37890 AT5G37930 AT5G41350 AT5G42940 AT5G43020 AT5G43710 AT5G46850 AT5G47760 AT5G49760 AT5G49980 AT5G51560 AT5G56460 AT5G57035 AT5G57360 AT5G58380 AT5G58410 AT5G58520 AT5G59010 AT5G59300 AT5G60300 AT5G62560 AT5G63140 AT5G63860 AT5G64610 AT5G64660 AT5G65740 AT5G65860 AT5G65920 AT1G69770 AT4G32620 AT5G06550 AT5G14620 AT1G09730 AT1G14350 AT1G54440 AT2G22370 AT3G10480 AT3G10490 AT3G24440 AT3G24880 AT3G45040 AT3G52250 AT5G22010 AT5G35910 AT5G66750"
6.49623714821249e-20,618,3092,"Protein modification process ","AT1G01540 AT1G01940 AT1G02145 AT1G03740 AT1G04210 AT1G04860 AT1G05170 AT1G08590 AT1G08750 AT1G10600 AT1G12400 AT1G12680 AT1G13460 AT1G14200 AT1G15570 AT1G16570 AT1G17110 AT1G18040 AT1G18340 AT1G20540 AT1G20610 AT1G20930 AT1G24190 AT1G24610 AT1G27630 AT1G28440 AT1G32930 AT1G47230 AT1G48210 AT1G49580 AT1G51170 AT1G52310 AT1G52540 AT1G53050 AT1G53165 AT1G53280 AT1G53290 AT1G53570 AT1G53710 AT1G53720 AT1G54140 AT1G55530 AT1G55860 AT1G56720 AT1G57820 AT1G60490 AT1G60800 AT1G63700 AT1G65040 AT1G65430 AT1G65650 AT1G66750 AT1G67580 AT1G69420 AT1G70060 AT1G70210 AT1G70530 AT1G71230 AT1G71830 AT1G72310 AT1G73820 AT1G76260 AT1G76310 AT1G78800 AT2G01820 AT2G02560 AT2G04550 AT2G11520 AT2G14255 AT2G16530 AT2G17620 AT2G19470 AT2G19670 AT2G21130 AT2G21470 AT2G22310 AT2G23950 AT2G24640 AT2G25740 AT2G25790 AT2G26430 AT2G26700 AT2G27350 AT2G28250 AT2G30880 AT2G31305 AT2G31510 AT2G32850 AT2G34650 AT2G35320 AT2G35620 AT2G36350 AT2G37840 AT2G38620 AT2G39720 AT2G40190 AT2G40830 AT2G41140 AT2G41490 AT2G41760 AT2G41890 AT2G43080 AT2G44660 AT2G44830 AT2G48010 AT2G48030 AT3G01380 AT3G02070 AT3G03550 AT3G04240 AT3G04480 AT3G05050 AT3G05090 AT3G06440 AT3G06820 AT3G06930 AT3G08720 AT3G08850 AT3G10540 AT3G11520 AT3G12270 AT3G13430 AT3G14400 AT3G14960 AT3G17205 AT3G17420 AT3G17510 AT3G17850 AT3G20020 AT3G20830 AT3G21220 AT3G23750 AT3G26020 AT3G28480 AT3G28970 AT3G29160 AT3G44600 AT3G44680 AT3G45630 AT3G45780 AT3G46460 AT3G48070 AT3G49590 AT3G50920 AT3G51390 AT3G51630 AT3G51850 AT3G54010 AT3G54130 AT3G54180 AT3G56930 AT3G59110 AT3G60800 AT3G61420 AT3G62770 AT4G00840 AT4G00990 AT4G01026 AT4G01730 AT4G03390 AT4G04700 AT4G04720 AT4G05200 AT4G10050 AT4G10730 AT4G11860 AT4G14350 AT4G14580 AT4G15080 AT4G15415 AT4G15880 AT4G16420 AT4G18230 AT4G19670 AT4G20270 AT4G21410 AT4G22305 AT4G23270 AT4G24100 AT4G24490 AT4G24560 AT4G24630 AT4G24940 AT4G26100 AT4G26400 AT4G28980 AT4G29940 AT4G30790 AT4G34370 AT4G35620 AT4G35905 AT4G36390 AT4G38230 AT4G38240 AT4G39270 AT5G02310 AT5G02800 AT5G03330 AT5G03470 AT5G04250 AT5G05460 AT5G05700 AT5G06460 AT5G06830 AT5G08415 AT5G10270 AT5G13160 AT5G14260 AT5G14530 AT5G15400 AT5G16000 AT5G16710 AT5G16800 AT5G17070 AT5G18190 AT5G18940 AT5G19130 AT5G20050 AT5G20990 AT5G23400 AT5G24430 AT5G25510 AT5G28080 AT5G28850 AT5G28900 AT5G37055 AT5G38460 AT5G38560 AT5G40030 AT5G40250 AT5G40280 AT5G44090 AT5G44100 AT5G44290 AT5G45190 AT5G47540 AT5G48630 AT5G48640 AT5G50020 AT5G53340 AT5G54380 AT5G54590 AT5G55170 AT5G56340 AT5G56580 AT5G56890 AT5G57015 AT5G57630 AT5G58350 AT5G58450 AT5G58575 AT5G60170 AT5G63110 AT5G63610 AT5G63760 AT5G63930 AT5G65530 AT5G66060 AT5G66850 AT5G66880 AT5G67530 AT5G67630 AT1G08490 AT1G08680 AT1G09020 AT1G49340 AT1G49780 AT1G63900 AT1G76710 AT1G77300 AT1G79810 AT2G01150 AT2G01210 AT2G25880 AT2G30360 AT2G31800 AT2G32710 AT2G39000 AT2G39660 AT2G39810 AT3G01650 AT3G05200 AT3G06483 AT3G06540 AT3G07370 AT3G09970 AT3G14980 AT3G18290 AT3G45240 AT3G47990 AT3G52450 AT3G55530 AT4G03415 AT4G08920 AT4G13160 AT4G14220 AT4G17410 AT4G18140 AT4G28650 AT4G31750 AT4G32660 AT5G03730 AT5G07270 AT5G11860 AT5G15120 AT5G20910 AT5G42200 AT5G45800 AT5G49665 AT5G55500 AT5G57050 AT5G64920 AT1G01640 AT1G02860 AT1G03430 AT1G03780 AT1G04790 AT1G04900 AT1G04910 AT1G05830 AT1G07630 AT1G08420 AT1G08460 AT1G08620 AT1G08710 AT1G10170 AT1G10210 AT1G10690 AT1G10850 AT1G12990 AT1G13690 AT1G14020 AT1G16270 AT1G16710 AT1G17550 AT1G18160 AT1G18390 AT1G20823 AT1G22510 AT1G23780 AT1G26830 AT1G26940 AT1G27190 AT1G27320 AT1G27440 AT1G27520 AT1G30000 AT1G30900 AT1G31420 AT1G32750 AT1G34130 AT1G34750 AT1G43690 AT1G43900 AT1G45050 AT1G47380 AT1G51590 AT1G51830 AT1G51940 AT1G53190 AT1G53510 AT1G53780 AT1G54150 AT1G55000 AT1G55900 AT1G61040 AT1G62330 AT1G63090 AT1G63170 AT1G63430 AT1G63500 AT1G63800 AT1G63850 AT1G64280 AT1G65410 AT1G66340 AT1G67340 AT1G68050 AT1G68410 AT1G69270 AT1G71410 AT1G72175 AT1G72770 AT1G73655 AT1G73670 AT1G77550 AT1G79000 AT1G79730 AT1G80290 AT1G80570 AT2G01735 AT2G01830 AT2G02220 AT2G05330 AT2G07180 AT2G14740 AT2G15580 AT2G16740 AT2G17020 AT2G17520 AT2G17530 AT2G17570 AT2G17930 AT2G18170 AT2G19430 AT2G20000 AT2G21950 AT2G23080 AT2G23380 AT2G23420 AT2G23450 AT2G24230 AT2G24240 AT2G24990 AT2G25710 AT2G26810 AT2G27210 AT2G28060 AT2G28890 AT2G30600 AT2G31880 AT2G32950 AT2G33580 AT2G33700 AT2G35910 AT2G38730 AT2G38950 AT2G39110 AT2G39445 AT2G39760 AT2G39940 AT2G40270 AT2G40730 AT2G40930 AT2G42030 AT2G42160 AT2G44270 AT2G45340 AT2G45950 AT2G46260 AT2G46340 AT2G46920 AT2G47860 AT3G01300 AT3G02340 AT3G02750 AT3G02800 AT3G02880 AT3G03810 AT3G04580 AT3G05870 AT3G06110 AT3G06190 AT3G06330 AT3G06670 AT3G08760 AT3G09100 AT3G09770 AT3G10810 AT3G12200 AT3G12340 AT3G12400 AT3G12620 AT3G12980 AT3G14720 AT3G15070 AT3G16720 AT3G16740 AT3G20740 AT3G21160 AT3G21640 AT3G22590 AT3G24660 AT3G24800 AT3G26000 AT3G27560 AT3G28700 AT3G29270 AT3G30300 AT3G44620 AT3G45100 AT3G46590 AT3G46820 AT3G47890 AT3G47910 AT3G48330 AT3G48430 AT3G48820 AT3G50780 AT3G51770 AT3G52280 AT3G53570 AT3G54350 AT3G55050 AT3G55450 AT3G55920 AT3G55960 AT3G56050 AT3G57170 AT3G57710 AT3G58130 AT3G58180 AT3G58530 AT3G59940 AT3G60080 AT3G60370 AT3G61990 AT3G62970 AT3G63260 AT4G00335 AT4G02405 AT4G02680 AT4G02740 AT4G06599 AT4G15180 AT4G16650 AT4G17070 AT4G18950 AT4G19660 AT4G20110 AT4G21510 AT4G22285 AT4G23050 AT4G23740 AT4G23860 AT4G24390 AT4G26430 AT4G27800 AT4G28400 AT4G30820 AT4G30860 AT4G31100 AT4G31110 AT4G33210 AT4G33920 AT4G33940 AT4G34100 AT4G35600 AT4G35910 AT4G37880 AT5G01520 AT5G01530 AT5G01720 AT5G01820 AT5G01830 AT5G01850 AT5G01950 AT5G02290 AT5G02410 AT5G03200 AT5G04540 AT5G04670 AT5G04940 AT5G05660 AT5G06750 AT5G10020 AT5G10650 AT5G10930 AT5G14210 AT5G14420 AT5G15080 AT5G16480 AT5G19000 AT5G19280 AT5G21326 AT5G22030 AT5G22840 AT5G24100 AT5G24270 AT5G27420 AT5G33290 AT5G35100 AT5G35570 AT5G37890 AT5G37930 AT5G41350 AT5G42940 AT5G43020 AT5G43710 AT5G46850 AT5G47760 AT5G49760 AT5G49980 AT5G51560 AT5G56460 AT5G57035 AT5G57360 AT5G58380 AT5G58410 AT5G58520 AT5G59010 AT5G59300 AT5G60300 AT5G62560 AT5G63140 AT5G63860 AT5G64610 AT5G64660 AT5G65740 AT5G65860 AT5G65920 AT1G69770 AT4G32620 AT5G06550 AT5G14620 AT1G09730 AT1G14350 AT1G54440 AT2G22370 AT3G10480 AT3G10490 AT3G24440 AT3G24880 AT3G45040 AT3G52250 AT5G22010 AT5G35910 AT5G66750"
2.13012023943391e-16,671,3532,"Macromolecule modification ","AT1G01540 AT1G01940 AT1G02145 AT1G03740 AT1G04210 AT1G04860 AT1G05170 AT1G08590 AT1G08750 AT1G09290 AT1G10490 AT1G10600 AT1G12400 AT1G12680 AT1G13460 AT1G14200 AT1G15570 AT1G16570 AT1G17110 AT1G18040 AT1G18340 AT1G20540 AT1G20610 AT1G20930 AT1G24190 AT1G24610 AT1G27630 AT1G28440 AT1G32930 AT1G34150 AT1G47230 AT1G48175 AT1G48210 AT1G49580 AT1G51170 AT1G52310 AT1G52540 AT1G53050 AT1G53165 AT1G53280 AT1G53290 AT1G53570 AT1G53710 AT1G53720 AT1G54140 AT1G55530 AT1G55860 AT1G56570 AT1G56720 AT1G57820 AT1G60490 AT1G60800 AT1G63700 AT1G65040 AT1G65430 AT1G65650 AT1G66750 AT1G67580 AT1G68720 AT1G69420 AT1G69770 AT1G70060 AT1G70210 AT1G70530 AT1G71230 AT1G71830 AT1G72310 AT1G73820 AT1G75230 AT1G76260 AT1G76310 AT1G76440 AT1G78800 AT2G01820 AT2G02560 AT2G04550 AT2G11520 AT2G14255 AT2G15690 AT2G16530 AT2G17620 AT2G19470 AT2G19670 AT2G21130 AT2G21470 AT2G22310 AT2G23950 AT2G24640 AT2G25740 AT2G25790 AT2G26430 AT2G26700 AT2G27350 AT2G28250 AT2G30880 AT2G31305 AT2G31510 AT2G32850 AT2G34410 AT2G34650 AT2G35320 AT2G35620 AT2G36350 AT2G37840 AT2G38620 AT2G39720 AT2G40190 AT2G40830 AT2G41140 AT2G41490 AT2G41760 AT2G41890 AT2G43080 AT2G44270 AT2G44660 AT2G44830 AT2G48010 AT2G48030 AT3G01380 AT3G02070 AT3G02320 AT3G03550 AT3G04240 AT3G04480 AT3G05050 AT3G05090 AT3G06440 AT3G06550 AT3G06820 AT3G06930 AT3G08720 AT3G08850 AT3G10540 AT3G11520 AT3G12270 AT3G13430 AT3G14400 AT3G14960 AT3G17205 AT3G17420 AT3G17510 AT3G17850 AT3G20020 AT3G20830 AT3G21220 AT3G23630 AT3G23750 AT3G26020 AT3G28480 AT3G28970 AT3G29160 AT3G44600 AT3G44680 AT3G45630 AT3G45780 AT3G46460 AT3G48070 AT3G49590 AT3G50880 AT3G50920 AT3G51390 AT3G51630 AT3G51850 AT3G54010 AT3G54130 AT3G54170 AT3G54180 AT3G56120 AT3G56930 AT3G59110 AT3G60800 AT3G61420 AT3G62770 AT4G00840 AT4G00990 AT4G01026 AT4G01730 AT4G03390 AT4G04700 AT4G04720 AT4G05200 AT4G10050 AT4G10730 AT4G11860 AT4G14350 AT4G14580 AT4G15080 AT4G15415 AT4G15880 AT4G16420 AT4G18230 AT4G19670 AT4G20270 AT4G21410 AT4G22305 AT4G23270 AT4G24100 AT4G24490 AT4G24560 AT4G24630 AT4G24940 AT4G26100 AT4G26400 AT4G28980 AT4G29940 AT4G30790 AT4G34370 AT4G35620 AT4G35905 AT4G35910 AT4G36390 AT4G38230 AT4G38240 AT4G39270 AT5G01230 AT5G02310 AT5G02800 AT5G03330 AT5G03470 AT5G04250 AT5G05460 AT5G05700 AT5G06460 AT5G06830 AT5G08415 AT5G10270 AT5G13160 AT5G14260 AT5G14530 AT5G15400 AT5G16000 AT5G16710 AT5G16800 AT5G17070 AT5G18190 AT5G18940 AT5G19130 AT5G20050 AT5G20990 AT5G23400 AT5G24430 AT5G24670 AT5G25510 AT5G26180 AT5G28080 AT5G28850 AT5G28900 AT5G37055 AT5G38460 AT5G38560 AT5G40030 AT5G40250 AT5G40280 AT5G44090 AT5G44100 AT5G44290 AT5G45190 AT5G47540 AT5G48630 AT5G48640 AT5G49160 AT5G50020 AT5G53340 AT5G54380 AT5G54590 AT5G55170 AT5G56340 AT5G56580 AT5G56890 AT5G57015 AT5G57280 AT5G57630 AT5G58350 AT5G58450 AT5G58575 AT5G60170 AT5G61030 AT5G61140 AT5G63110 AT5G63610 AT5G63760 AT5G63930 AT5G65530 AT5G66060 AT5G66850 AT5G66880 AT5G67530 AT5G67630 AT1G08490 AT1G08680 AT1G09020 AT1G49340 AT1G49780 AT1G63900 AT1G76710 AT1G77300 AT1G79810 AT2G01150 AT2G01210 AT2G25880 AT2G30360 AT2G31800 AT2G32710 AT2G39000 AT2G39660 AT2G39810 AT3G01650 AT3G05200 AT3G06483 AT3G06540 AT3G07370 AT3G09970 AT3G14980 AT3G18290 AT3G23780 AT3G45240 AT3G47990 AT3G52450 AT3G55530 AT4G03415 AT4G08920 AT4G13160 AT4G14220 AT4G17410 AT4G18140 AT4G28650 AT4G31750 AT4G32660 AT5G03730 AT5G07270 AT5G11860 AT5G15120 AT5G20910 AT5G42200 AT5G45800 AT5G49665 AT5G55500 AT5G57050 AT5G64920 AT1G01640 AT1G02860 AT1G03430 AT1G03530 AT1G03780 AT1G04790 AT1G04900 AT1G04910 AT1G05830 AT1G07630 AT1G08420 AT1G08460 AT1G08620 AT1G08710 AT1G10170 AT1G10210 AT1G10690 AT1G10850 AT1G12990 AT1G13690 AT1G14020 AT1G16270 AT1G16710 AT1G17550 AT1G18160 AT1G18390 AT1G20370 AT1G20823 AT1G22510 AT1G23780 AT1G26830 AT1G26940 AT1G27190 AT1G27320 AT1G27440 AT1G27520 AT1G30000 AT1G30900 AT1G31420 AT1G32750 AT1G34130 AT1G34750 AT1G43690 AT1G43900 AT1G45050 AT1G47380 AT1G51590 AT1G51830 AT1G51940 AT1G53190 AT1G53510 AT1G53780 AT1G54150 AT1G55000 AT1G55900 AT1G61040 AT1G62330 AT1G63090 AT1G63170 AT1G63430 AT1G63500 AT1G63800 AT1G63850 AT1G64280 AT1G65410 AT1G66340 AT1G67340 AT1G68050 AT1G68410 AT1G69270 AT1G71410 AT1G72175 AT1G72770 AT1G73655 AT1G73670 AT1G77550 AT1G79000 AT1G79730 AT1G80290 AT1G80570 AT2G01735 AT2G01830 AT2G02220 AT2G05330 AT2G07180 AT2G14740 AT2G15580 AT2G16740 AT2G17020 AT2G17520 AT2G17530 AT2G17570 AT2G17930 AT2G18170 AT2G18410 AT2G19430 AT2G20000 AT2G21950 AT2G23080 AT2G23380 AT2G23420 AT2G23450 AT2G24230 AT2G24240 AT2G24990 AT2G25710 AT2G26810 AT2G27210 AT2G28060 AT2G28890 AT2G30600 AT2G31880 AT2G32950 AT2G33580 AT2G33700 AT2G35910 AT2G38730 AT2G38950 AT2G39110 AT2G39445 AT2G39760 AT2G39940 AT2G40270 AT2G40730 AT2G40930 AT2G42030 AT2G42160 AT2G45340 AT2G45950 AT2G46260 AT2G46340 AT2G46920 AT2G47860 AT3G01300 AT3G02340 AT3G02750 AT3G02800 AT3G02880 AT3G03810 AT3G04580 AT3G05870 AT3G06110 AT3G06190 AT3G06330 AT3G06670 AT3G08760 AT3G09100 AT3G09770 AT3G10810 AT3G11220 AT3G12200 AT3G12340 AT3G12400 AT3G12620 AT3G12980 AT3G14720 AT3G15070 AT3G16720 AT3G16740 AT3G17310 AT3G20650 AT3G20740 AT3G21160 AT3G21640 AT3G22590 AT3G24660 AT3G24800 AT3G26000 AT3G27560 AT3G28700 AT3G29270 AT3G30300 AT3G44620 AT3G45100 AT3G46590 AT3G46820 AT3G47890 AT3G47910 AT3G48330 AT3G48430 AT3G48820 AT3G49640 AT3G50780 AT3G51770 AT3G52210 AT3G52280 AT3G53570 AT3G54350 AT3G55050 AT3G55450 AT3G55920 AT3G55960 AT3G56050 AT3G57170 AT3G57710 AT3G58130 AT3G58180 AT3G58530 AT3G59940 AT3G60080 AT3G60370 AT3G61990 AT3G62970 AT3G63030 AT3G63260 AT4G00335 AT4G02405 AT4G02680 AT4G02740 AT4G06599 AT4G15180 AT4G16650 AT4G17070 AT4G18950 AT4G19660 AT4G20110 AT4G21510 AT4G21770 AT4G22285 AT4G22720 AT4G23050 AT4G23740 AT4G23860 AT4G24390 AT4G26430 AT4G27800 AT4G28400 AT4G30820 AT4G30860 AT4G31100 AT4G31110 AT4G33210 AT4G33920 AT4G33940 AT4G34100 AT4G35600 AT4G37880 AT4G38890 AT5G01520 AT5G01530 AT5G01720 AT5G01820 AT5G01830 AT5G01850 AT5G01950 AT5G02290 AT5G02410 AT5G03200 AT5G04540 AT5G04670 AT5G04940 AT5G05660 AT5G06750 AT5G10020 AT5G10650 AT5G10930 AT5G14210 AT5G14420 AT5G14620 AT5G15080 AT5G16480 AT5G19000 AT5G19280 AT5G21326 AT5G22030 AT5G22840 AT5G24100 AT5G24270 AT5G27420 AT5G33290 AT5G35100 AT5G35330 AT5G35570 AT5G37890 AT5G37930 AT5G41350 AT5G42940 AT5G43020 AT5G43710 AT5G46850 AT5G47760 AT5G49760 AT5G49980 AT5G51140 AT5G51560 AT5G56460 AT5G57035 AT5G57360 AT5G58380 AT5G58410 AT5G58520 AT5G59010 AT5G59300 AT5G60300 AT5G62560 AT5G63140 AT5G63860 AT5G64610 AT5G64660 AT5G65740 AT5G65860 AT5G65920 AT1G15910 AT3G14890 AT4G32620 AT5G06550 AT1G05910 AT1G08130 AT1G09730 AT1G14350 AT1G36370 AT1G50410 AT1G54440 AT1G80420 AT2G16485 AT2G22370 AT3G05680 AT3G10480 AT3G10490 AT3G11030 AT3G15120 AT3G24440 AT3G24880 AT3G26410 AT3G45040 AT3G49250 AT3G52250 AT4G16265 AT5G04290 AT5G22010 AT5G35910 AT5G66750"
