"Enrichment FDR","Genes in list","Total genes","Functional Category","Genes"
5.72946147762297e-09,559,3121,"Anatomical structure development ","AT1G05520 AT1G12740 AT1G14920 AT1G15550 AT1G18100 AT1G22770 AT1G28520 AT1G43850 AT1G63820 AT1G65580 AT1G73340 AT1G78600 AT2G20130 AT2G21130 AT2G27550 AT2G32440 AT2G35110 AT2G35320 AT2G35612 AT2G42400 AT3G03450 AT3G05120 AT3G23660 AT3G46550 AT3G55920 AT3G62020 AT3G63010 AT4G02560 AT4G02980 AT4G23640 AT4G27060 AT4G28250 AT4G35390 AT4G35950 AT5G14070 AT5G15680 AT5G18410 AT5G43670 AT2G28250 AT2G28350 AT2G46340 AT5G39990 AT1G06180 AT1G07630 AT1G08590 AT1G11760 AT1G12040 AT1G13620 AT1G14350 AT1G15440 AT1G19520 AT1G21700 AT1G27320 AT1G28420 AT1G29290 AT1G51190 AT1G61040 AT1G62440 AT1G63700 AT1G68050 AT1G69270 AT1G71230 AT1G74720 AT1G76710 AT1G79200 AT1G79430 AT1G79580 AT1G79730 AT1G80940 AT2G01505 AT2G01830 AT2G06990 AT2G20562 AT2G22370 AT2G23380 AT2G25930 AT2G26700 AT2G28890 AT2G31082 AT2G31960 AT2G33610 AT2G34140 AT2G34650 AT2G35230 AT2G35510 AT2G36740 AT2G36850 AT2G36890 AT2G42160 AT2G42230 AT2G43410 AT2G44080 AT2G45400 AT2G46410 AT2G46710 AT2G46920 AT2G47620 AT2G47790 AT2G47990 AT2G48160 AT3G02170 AT3G04240 AT3G04740 AT3G05970 AT3G07220 AT3G08850 AT3G10480 AT3G10490 AT3G11220 AT3G12680 AT3G15380 AT3G16440 AT3G20740 AT3G20840 AT3G22590 AT3G22990 AT3G23980 AT3G24440 AT3G26744 AT3G28455 AT3G33520 AT3G44735 AT3G47620 AT3G50870 AT3G52280 AT3G54010 AT3G54430 AT3G60830 AT3G62300 AT4G00450 AT4G03550 AT4G04885 AT4G11280 AT4G14720 AT4G14770 AT4G15415 AT4G20270 AT4G24500 AT4G26430 AT4G28650 AT4G30580 AT4G30860 AT4G34430 AT4G36920 AT4G37180 AT5G12330 AT5G13300 AT5G13480 AT5G14530 AT5G14750 AT5G16490 AT5G16560 AT5G19400 AT5G19740 AT5G22790 AT5G37055 AT5G37890 AT5G37930 AT5G39660 AT5G44180 AT5G55500 AT5G57360 AT5G64070 AT5G64390 AT5G65640 AT1G64110 AT2G22900 AT2G28950 AT2G43570 AT3G23630 AT3G27960 AT3G54180 AT3G54420 AT3G55850 AT4G10500 AT4G32880 AT4G34410 AT5G51640 AT1G03060 AT1G03430 AT1G03840 AT1G08760 AT1G09100 AT1G15570 AT1G15940 AT1G16710 AT1G23380 AT1G31930 AT1G48550 AT1G52150 AT1G60800 AT1G64990 AT1G65650 AT1G71040 AT1G71830 AT1G79000 AT1G80490 AT2G02970 AT2G23950 AT2G31880 AT2G32950 AT2G39350 AT2G40750 AT3G01040 AT3G06930 AT3G12280 AT3G12980 AT3G15880 AT3G16785 AT3G16830 AT3G21220 AT3G45590 AT3G52250 AT3G55510 AT3G57880 AT3G60800 AT4G08920 AT4G14220 AT4G14510 AT4G19180 AT4G24560 AT4G30980 AT4G31920 AT4G33240 AT4G34840 AT4G38350 AT5G03220 AT5G03280 AT5G03470 AT5G04340 AT5G04950 AT5G05700 AT5G06550 AT5G10170 AT5G10270 AT5G15470 AT5G37020 AT5G43270 AT5G43900 AT5G44160 AT5G45190 AT5G46760 AT5G53470 AT5G54380 AT5G55480 AT5G58440 AT5G66880 AT1G04950 AT1G05190 AT1G07640 AT1G08030 AT1G08260 AT1G08410 AT1G08600 AT1G08750 AT1G09700 AT1G09730 AT1G10130 AT1G12240 AT1G12560 AT1G13120 AT1G13300 AT1G15330 AT1G16280 AT1G16300 AT1G16340 AT1G16570 AT1G17110 AT1G17560 AT1G17690 AT1G18390 AT1G18580 AT1G19300 AT1G20823 AT1G20930 AT1G21070 AT1G22740 AT1G26830 AT1G26840 AT1G28240 AT1G29940 AT1G31070 AT1G31420 AT1G32310 AT1G32500 AT1G32930 AT1G36160 AT1G44900 AT1G47270 AT1G47550 AT1G48380 AT1G49040 AT1G49320 AT1G51170 AT1G53190 AT1G53500 AT1G54060 AT1G54130 AT1G54490 AT1G56180 AT1G56580 AT1G58340 AT1G60420 AT1G60490 AT1G64440 AT1G66340 AT1G66470 AT1G66740 AT1G66750 AT1G67120 AT1G67140 AT1G67360 AT1G67580 AT1G69770 AT1G71090 AT1G71400 AT1G72440 AT1G73430 AT1G73980 AT1G75390 AT1G75410 AT1G77300 AT1G78240 AT1G79810 AT1G80350 AT2G01210 AT2G01735 AT2G01820 AT2G01850 AT2G02480 AT2G02560 AT2G02810 AT2G03070 AT2G13540 AT2G15430 AT2G15690 AT2G17870 AT2G19450 AT2G19560 AT2G20000 AT2G20190 AT2G21150 AT2G21470 AT2G22250 AT2G22300 AT2G22420 AT2G22640 AT2G22840 AT2G24060 AT2G26170 AT2G27460 AT2G28620 AT2G30130 AT2G30140 AT2G30330 AT2G31270 AT2G31305 AT2G34570 AT2G34720 AT2G35020 AT2G35270 AT2G35620 AT2G35940 AT2G37430 AT2G37620 AT2G37690 AT2G38020 AT2G38440 AT2G38620 AT2G39810 AT2G39940 AT2G41060 AT2G41500 AT2G42080 AT2G42280 AT2G48140 AT3G01150 AT3G01780 AT3G02860 AT3G03690 AT3G03773 AT3G03810 AT3G04680 AT3G05010 AT3G05040 AT3G05090 AT3G05680 AT3G06440 AT3G06810 AT3G07130 AT3G07650 AT3G09090 AT3G10160 AT3G10380 AT3G10500 AT3G11270 AT3G11964 AT3G12400 AT3G12700 AT3G13490 AT3G14180 AT3G15010 AT3G15070 AT3G16810 AT3G21200 AT3G21640 AT3G23090 AT3G23580 AT3G24880 AT3G26640 AT3G27560 AT3G27750 AT3G29810 AT3G44600 AT3G44680 AT3G45040 AT3G45100 AT3G46740 AT3G48090 AT3G48330 AT3G48430 AT3G48820 AT3G49180 AT3G50590 AT3G51390 AT3G51630 AT3G51770 AT3G52150 AT3G52430 AT3G52860 AT3G53180 AT3G54170 AT3G55200 AT3G55370 AT3G55400 AT3G55490 AT3G56930 AT3G56990 AT3G57300 AT3G61650 AT3G62770 AT4G00060 AT4G00231 AT4G00990 AT4G01430 AT4G01630 AT4G02030 AT4G02350 AT4G04040 AT4G05440 AT4G05450 AT4G09140 AT4G11850 AT4G14040 AT4G14147 AT4G14300 AT4G15180 AT4G15880 AT4G16444 AT4G19040 AT4G20780 AT4G21540 AT4G21800 AT4G23810 AT4G25050 AT4G25320 AT4G26750 AT4G27950 AT4G28980 AT4G30790 AT4G33210 AT4G33980 AT4G34100 AT4G34540 AT4G35600 AT4G35910 AT4G36480 AT4G36810 AT4G37740 AT4G38490 AT5G02310 AT5G02410 AT5G02600 AT5G02820 AT5G03730 AT5G04920 AT5G04990 AT5G05340 AT5G05620 AT5G06160 AT5G06780 AT5G06839 AT5G09680 AT5G12080 AT5G12130 AT5G13570 AT5G14220 AT5G14930 AT5G16260 AT5G16750 AT5G16910 AT5G17400 AT5G19280 AT5G22290 AT5G22640 AT5G23080 AT5G24630 AT5G24710 AT5G27150 AT5G27540 AT5G35700 AT5G37260 AT5G37850 AT5G40280 AT5G42390 AT5G42810 AT5G45710 AT5G45800 AT5G45940 AT5G47640 AT5G48030 AT5G48150 AT5G48300 AT5G48600 AT5G49160 AT5G49665 AT5G51060 AT5G51340 AT5G51590 AT5G53180 AT5G53860 AT5G55630 AT5G55820 AT5G56580 AT5G57280 AT5G57620 AT5G58100 AT5G59570 AT5G60690 AT5G62000 AT5G63110 AT5G63220 AT5G63780 AT5G64340 AT5G64610 AT5G64930 AT5G65000 AT5G65530 AT5G65683 AT5G66100 AT5G66730 AT5G67100 AT1G32440 AT4G13395 AT5G59510 AT1G30825 AT2G20610 AT3G01640 AT3G52910"
9.51911412308161e-09,218,1025,"Protein localization ","AT1G02690 AT1G05810 AT1G06950 AT1G08350 AT1G08750 AT1G10180 AT1G10390 AT1G11905 AT1G13120 AT1G14850 AT1G22740 AT1G24310 AT1G27700 AT1G30900 AT1G47270 AT1G47550 AT1G48240 AT1G48550 AT1G53530 AT1G55130 AT1G55900 AT1G65040 AT1G69420 AT1G73790 AT1G75850 AT2G01110 AT2G13540 AT2G14255 AT2G14740 AT2G16900 AT2G16950 AT2G18240 AT2G19560 AT2G20840 AT2G20960 AT2G24170 AT2G30710 AT2G31660 AT2G31680 AT2G36680 AT2G39280 AT2G41620 AT2G43130 AT2G46520 AT3G02460 AT3G02950 AT3G04770 AT3G05040 AT3G05710 AT3G07410 AT3G07890 AT3G09700 AT3G10380 AT3G10650 AT3G11820 AT3G13860 AT3G14120 AT3G15060 AT3G15980 AT3G17340 AT3G24350 AT3G28670 AT3G49350 AT3G49590 AT3G49990 AT3G51310 AT3G51390 AT3G52190 AT3G53230 AT3G54380 AT3G54826 AT3G56930 AT3G60800 AT3G62770 AT3G62880 AT4G00840 AT4G01730 AT4G02150 AT4G05000 AT4G08320 AT4G15080 AT4G17140 AT4G18430 AT4G18800 AT4G20110 AT4G24630 AT4G26780 AT4G27040 AT4G27690 AT4G29950 AT4G38760 AT5G02200 AT5G03030 AT5G04920 AT5G09860 AT5G15930 AT5G16280 AT5G16620 AT5G17060 AT5G27280 AT5G35520 AT5G42920 AT5G47480 AT5G47520 AT5G49830 AT5G50020 AT5G50550 AT5G50650 AT5G55200 AT5G55510 AT5G56130 AT5G56290 AT5G61880 AT5G62500 AT5G63220 AT5G64090 AT5G65270 AT5G67270 AT1G63900 AT2G38410 AT3G04340 AT3G12360 AT3G46740 AT5G04990 AT5G22640 AT5G52440 AT5G55500 ATCG00860 AT1G02280 AT1G03380 AT1G04070 AT1G05520 AT1G05960 AT1G08190 AT1G13160 AT1G15130 AT1G23900 AT1G29060 AT1G33410 AT1G34220 AT1G54090 AT1G54710 AT1G55690 AT1G56590 AT1G72470 AT1G73430 AT1G75340 AT1G76850 AT1G76970 AT1G77140 AT1G79070 AT2G05170 AT2G15290 AT2G20790 AT2G27460 AT2G32900 AT2G34840 AT2G36360 AT2G37840 AT2G38020 AT2G39380 AT2G44140 AT2G47450 AT2G47840 AT3G06540 AT3G09800 AT3G12400 AT3G15380 AT3G15920 AT3G16270 AT3G23660 AT3G27070 AT3G44340 AT3G50860 AT3G55150 AT3G59950 AT3G60640 AT3G60860 AT4G02030 AT4G03320 AT4G14600 AT4G16444 AT4G23460 AT4G26750 AT4G27730 AT4G30790 AT4G30840 AT4G32160 AT4G32640 AT4G37130 AT4G38200 AT4G38490 AT4G39170 AT5G09260 AT5G17550 AT5G21990 AT5G22780 AT5G23550 AT5G24170 AT5G28750 AT5G40930 AT5G43670 AT5G49910 AT5G50230 AT5G51200 AT5G52990 AT5G55710 AT5G58440 AT5G59730 AT5G63880 AT5G64410 AT2G36305 AT4G24500 AT1G03840 AT1G79810 AT5G16000 AT5G44160 AT4G21160"
9.51911412308161e-09,189,858,"Protein transport ","AT1G02690 AT1G05810 AT1G06950 AT1G10390 AT1G13120 AT1G14850 AT1G22740 AT1G24310 AT1G27700 AT1G30900 AT1G48240 AT1G48550 AT1G53530 AT1G55900 AT1G65040 AT1G69420 AT1G75850 AT2G01110 AT2G13540 AT2G14255 AT2G14740 AT2G16950 AT2G19560 AT2G20840 AT2G30710 AT2G31660 AT2G31680 AT2G36680 AT2G39280 AT2G41620 AT2G43130 AT2G46520 AT3G02460 AT3G02950 AT3G04770 AT3G05040 AT3G05710 AT3G07410 AT3G07890 AT3G09700 AT3G10380 AT3G10650 AT3G11820 AT3G13860 AT3G14120 AT3G15060 AT3G15980 AT3G17340 AT3G24350 AT3G49350 AT3G49990 AT3G51310 AT3G51390 AT3G52190 AT3G53230 AT3G54380 AT3G54826 AT3G56930 AT3G60800 AT3G62880 AT4G00840 AT4G01730 AT4G02150 AT4G05000 AT4G08320 AT4G15080 AT4G17140 AT4G18430 AT4G18800 AT4G20110 AT4G24630 AT4G26780 AT4G27040 AT4G27690 AT4G29950 AT4G38760 AT5G03030 AT5G04920 AT5G09860 AT5G15930 AT5G16620 AT5G17060 AT5G27280 AT5G42920 AT5G47480 AT5G47520 AT5G50020 AT5G50550 AT5G50650 AT5G55200 AT5G55510 AT5G56130 AT5G56290 AT5G61880 AT5G65270 AT1G63900 AT2G38410 AT3G04340 AT3G46740 AT5G22640 AT5G52440 AT5G55500 ATCG00860 AT1G02280 AT1G03380 AT1G04070 AT1G05520 AT1G08190 AT1G11905 AT1G13160 AT1G15130 AT1G23900 AT1G29060 AT1G33410 AT1G34220 AT1G54090 AT1G54710 AT1G55690 AT1G56590 AT1G72470 AT1G73430 AT1G75340 AT1G76850 AT1G76970 AT1G77140 AT1G79070 AT2G05170 AT2G15290 AT2G20790 AT2G27460 AT2G32900 AT2G34840 AT2G36360 AT2G37840 AT2G38020 AT2G39380 AT2G44140 AT2G47450 AT2G47840 AT3G06540 AT3G09800 AT3G12400 AT3G15380 AT3G15920 AT3G16270 AT3G23660 AT3G27070 AT3G44340 AT3G49590 AT3G50860 AT3G55150 AT3G59950 AT3G60640 AT3G60860 AT3G62770 AT4G02030 AT4G03320 AT4G14600 AT4G23460 AT4G26750 AT4G27730 AT4G30790 AT4G30840 AT4G32160 AT4G32640 AT4G37130 AT4G38200 AT4G38490 AT4G39170 AT5G09260 AT5G17550 AT5G21990 AT5G22780 AT5G23550 AT5G24170 AT5G28750 AT5G40930 AT5G43670 AT5G49910 AT5G50230 AT5G51200 AT5G52990 AT5G55710 AT5G58440 AT5G59730 AT5G63880 AT5G64410 AT1G79810 AT4G21160"
1.48277371120836e-08,215,1013,"Cellular localization ","AT1G02690 AT1G03360 AT1G05520 AT1G05810 AT1G06950 AT1G08350 AT1G08750 AT1G10180 AT1G10390 AT1G11905 AT1G13120 AT1G14850 AT1G15660 AT1G22740 AT1G24310 AT1G27700 AT1G30900 AT1G47270 AT1G47550 AT1G48240 AT1G48550 AT1G50120 AT1G53530 AT1G53710 AT1G55130 AT1G55900 AT1G58070 AT1G65040 AT1G69420 AT1G73790 AT1G75850 AT1G76850 AT2G01110 AT2G05170 AT2G13540 AT2G14255 AT2G14740 AT2G16900 AT2G16950 AT2G18240 AT2G19560 AT2G20960 AT2G24170 AT2G25355 AT2G26570 AT2G30330 AT2G30710 AT2G31270 AT2G31660 AT2G31680 AT2G32900 AT2G34840 AT2G36680 AT2G38020 AT2G39280 AT2G41620 AT2G43130 AT2G44640 AT2G46520 AT3G02460 AT3G02950 AT3G04770 AT3G05040 AT3G05710 AT3G07410 AT3G07890 AT3G09700 AT3G10380 AT3G10650 AT3G11820 AT3G13860 AT3G14120 AT3G15060 AT3G15980 AT3G17340 AT3G20560 AT3G23660 AT3G24350 AT3G49350 AT3G49590 AT3G49990 AT3G51310 AT3G51390 AT3G52190 AT3G53230 AT3G54380 AT3G54826 AT3G56930 AT3G60800 AT3G62770 AT3G62880 AT3G63150 AT4G00840 AT4G01730 AT4G02030 AT4G02150 AT4G05000 AT4G08320 AT4G15080 AT4G17140 AT4G18430 AT4G18800 AT4G20110 AT4G24630 AT4G26780 AT4G27040 AT4G27690 AT4G29950 AT4G38760 AT5G02200 AT5G03030 AT5G04920 AT5G09860 AT5G15930 AT5G16280 AT5G16620 AT5G17060 AT5G27280 AT5G27540 AT5G35520 AT5G42920 AT5G43670 AT5G47480 AT5G47520 AT5G49830 AT5G49880 AT5G50020 AT5G50550 AT5G50650 AT5G54440 AT5G55200 AT5G55510 AT5G56130 AT5G56290 AT5G58700 AT5G61880 AT5G62500 AT5G63220 AT5G64090 AT5G65270 AT5G67270 AT1G63900 AT2G38410 AT3G04340 AT3G12360 AT3G46740 AT5G04990 AT5G16490 AT5G22640 AT5G47820 AT5G52440 AT5G55500 ATCG00860 AT1G02280 AT1G04070 AT1G05960 AT1G08190 AT1G13160 AT1G23900 AT1G56590 AT1G73430 AT1G76970 AT1G77140 AT1G79070 AT2G20790 AT2G27460 AT2G27900 AT2G36360 AT2G47450 AT3G06540 AT3G16270 AT3G27070 AT3G44340 AT3G50860 AT3G54860 AT4G02350 AT4G11790 AT4G16444 AT4G23460 AT4G32640 AT4G37130 AT4G38490 AT5G16210 AT5G20610 AT5G22780 AT5G40930 AT5G51200 AT1G24560 AT1G27695 AT2G36305 AT5G17550 AT5G21990 AT1G03060 AT1G03840 AT1G29060 AT1G33410 AT1G66340 AT1G79810 AT2G15290 AT3G20320 AT3G45780 AT3G60860 AT3G61650 AT4G03320 AT4G03550 AT4G26850 AT5G03280 AT5G05620 AT5G16000 AT5G43900 AT5G44160 AT5G49910 AT5G55280 AT4G21160 AT5G19320"
4.27451427553234e-08,163,727,"Intracellular transport ","AT1G02690 AT1G05520 AT1G05810 AT1G06950 AT1G10390 AT1G11905 AT1G13120 AT1G14850 AT1G22740 AT1G24310 AT1G27700 AT1G30900 AT1G48240 AT1G48550 AT1G50120 AT1G53530 AT1G53710 AT1G55900 AT1G65040 AT1G69420 AT1G75850 AT2G01110 AT2G13540 AT2G14255 AT2G14740 AT2G16950 AT2G19560 AT2G30330 AT2G30710 AT2G31660 AT2G31680 AT2G32900 AT2G34840 AT2G36680 AT2G38020 AT2G39280 AT2G41620 AT2G43130 AT2G44640 AT2G46520 AT3G02460 AT3G02950 AT3G04770 AT3G05040 AT3G05710 AT3G07410 AT3G07890 AT3G09700 AT3G10380 AT3G10650 AT3G11820 AT3G13860 AT3G14120 AT3G15060 AT3G15980 AT3G17340 AT3G20560 AT3G23660 AT3G24350 AT3G49350 AT3G49990 AT3G51310 AT3G51390 AT3G52190 AT3G53230 AT3G54380 AT3G54826 AT3G56930 AT3G60800 AT3G62880 AT3G63150 AT4G00840 AT4G01730 AT4G02030 AT4G02150 AT4G05000 AT4G08320 AT4G15080 AT4G17140 AT4G18430 AT4G18800 AT4G20110 AT4G24630 AT4G26780 AT4G27040 AT4G27690 AT4G29950 AT4G38760 AT5G03030 AT5G04920 AT5G09860 AT5G15930 AT5G16280 AT5G16620 AT5G17060 AT5G27280 AT5G27540 AT5G42920 AT5G43670 AT5G47480 AT5G47520 AT5G50020 AT5G50550 AT5G50650 AT5G54440 AT5G55200 AT5G55510 AT5G56130 AT5G56290 AT5G61880 AT5G65270 AT1G63900 AT2G38410 AT3G04340 AT3G46740 AT5G22640 AT5G47820 AT5G52440 AT5G55500 ATCG00860 AT1G02280 AT1G04070 AT1G08190 AT1G13160 AT1G23900 AT1G56590 AT1G73430 AT1G76970 AT1G79070 AT2G05170 AT2G20790 AT2G27460 AT2G27900 AT2G36360 AT2G47450 AT3G06540 AT3G16270 AT3G27070 AT3G44340 AT3G50860 AT4G11790 AT4G23460 AT4G32640 AT4G37130 AT4G38490 AT5G16210 AT5G22780 AT5G40930 AT5G51200 AT1G24560 AT1G27695 AT1G77140 AT5G17550 AT5G20610 AT5G21990 AT1G33410 AT1G79810 AT2G15290 AT3G20320 AT4G03320 AT5G49910 AT4G21160 AT5G19320"
4.27451427553234e-08,173,783,"Establishment of localization in cell ","AT1G02690 AT1G05520 AT1G05810 AT1G06950 AT1G10390 AT1G11905 AT1G13120 AT1G14850 AT1G15660 AT1G22740 AT1G24310 AT1G27700 AT1G30900 AT1G48240 AT1G48550 AT1G50120 AT1G53530 AT1G53710 AT1G55900 AT1G58070 AT1G65040 AT1G69420 AT1G75850 AT2G01110 AT2G13540 AT2G14255 AT2G14740 AT2G16950 AT2G19560 AT2G26570 AT2G30330 AT2G30710 AT2G31270 AT2G31660 AT2G31680 AT2G32900 AT2G34840 AT2G36680 AT2G38020 AT2G39280 AT2G41620 AT2G43130 AT2G44640 AT2G46520 AT3G02460 AT3G02950 AT3G04770 AT3G05040 AT3G05710 AT3G07410 AT3G07890 AT3G09700 AT3G10380 AT3G10650 AT3G11820 AT3G13860 AT3G14120 AT3G15060 AT3G15980 AT3G17340 AT3G20560 AT3G23660 AT3G24350 AT3G49350 AT3G49990 AT3G51310 AT3G51390 AT3G52190 AT3G53230 AT3G54380 AT3G54826 AT3G56930 AT3G60800 AT3G62880 AT3G63150 AT4G00840 AT4G01730 AT4G02030 AT4G02150 AT4G05000 AT4G08320 AT4G15080 AT4G17140 AT4G18430 AT4G18800 AT4G20110 AT4G24630 AT4G26780 AT4G27040 AT4G27690 AT4G29950 AT4G38760 AT5G03030 AT5G04920 AT5G09860 AT5G15930 AT5G16280 AT5G16620 AT5G17060 AT5G27280 AT5G27540 AT5G42920 AT5G43670 AT5G47480 AT5G47520 AT5G49880 AT5G50020 AT5G50550 AT5G50650 AT5G54440 AT5G55200 AT5G55510 AT5G56130 AT5G56290 AT5G58700 AT5G61880 AT5G65270 AT1G63900 AT2G38410 AT3G04340 AT3G46740 AT5G16490 AT5G22640 AT5G47820 AT5G52440 AT5G55500 ATCG00860 AT1G02280 AT1G04070 AT1G08190 AT1G13160 AT1G23900 AT1G56590 AT1G73430 AT1G76970 AT1G79070 AT2G05170 AT2G20790 AT2G27460 AT2G27900 AT2G36360 AT2G47450 AT3G06540 AT3G16270 AT3G27070 AT3G44340 AT3G50860 AT4G11790 AT4G23460 AT4G32640 AT4G37130 AT4G38490 AT5G16210 AT5G20610 AT5G22780 AT5G40930 AT5G51200 AT1G24560 AT1G27695 AT1G77140 AT5G17550 AT5G21990 AT1G33410 AT1G79810 AT2G15290 AT3G20320 AT3G45780 AT4G03320 AT5G04990 AT5G49910 AT5G55280 AT4G21160 AT5G19320"
5.39265377128525e-08,258,1284,"Macromolecule localization ","AT1G02690 AT1G03360 AT1G05810 AT1G06950 AT1G08350 AT1G08750 AT1G10180 AT1G10390 AT1G11905 AT1G13120 AT1G13210 AT1G14850 AT1G17500 AT1G22740 AT1G24310 AT1G27700 AT1G30900 AT1G47270 AT1G47550 AT1G48240 AT1G48550 AT1G53530 AT1G55130 AT1G55900 AT1G55960 AT1G65040 AT1G68710 AT1G69420 AT1G72700 AT1G73790 AT1G75850 AT2G01110 AT2G13540 AT2G14255 AT2G14740 AT2G16900 AT2G16950 AT2G18240 AT2G19560 AT2G20840 AT2G20960 AT2G24170 AT2G25355 AT2G30710 AT2G31660 AT2G31680 AT2G36680 AT2G39280 AT2G41620 AT2G43130 AT2G44640 AT2G46520 AT3G02460 AT3G02950 AT3G04770 AT3G05040 AT3G05710 AT3G07410 AT3G07890 AT3G09700 AT3G10380 AT3G10650 AT3G11820 AT3G13860 AT3G14120 AT3G15060 AT3G15980 AT3G17340 AT3G24350 AT3G28670 AT3G47730 AT3G49350 AT3G49590 AT3G49990 AT3G51310 AT3G51390 AT3G52190 AT3G53230 AT3G54380 AT3G54826 AT3G56930 AT3G60800 AT3G62770 AT3G62880 AT4G00840 AT4G01730 AT4G02150 AT4G05000 AT4G08320 AT4G15080 AT4G17140 AT4G18430 AT4G18800 AT4G20110 AT4G24630 AT4G26780 AT4G27040 AT4G27690 AT4G28820 AT4G29950 AT4G38760 AT5G02200 AT5G03030 AT5G04920 AT5G04930 AT5G09860 AT5G15930 AT5G16280 AT5G16620 AT5G17060 AT5G27280 AT5G35520 AT5G42920 AT5G44240 AT5G47480 AT5G47520 AT5G49830 AT5G50020 AT5G50550 AT5G50650 AT5G54170 AT5G55200 AT5G55510 AT5G56130 AT5G56290 AT5G61880 AT5G62500 AT5G63220 AT5G64090 AT5G65270 AT5G67270 AT1G63900 AT2G38410 AT3G04340 AT3G12360 AT3G46740 AT5G04990 AT5G22640 AT5G52440 AT5G55500 ATCG00860 AT1G02280 AT1G03380 AT1G04070 AT1G05520 AT1G05960 AT1G08190 AT1G13160 AT1G13170 AT1G15130 AT1G23900 AT1G27695 AT1G29060 AT1G33410 AT1G34220 AT1G53590 AT1G54090 AT1G54710 AT1G55690 AT1G56590 AT1G65410 AT1G72470 AT1G73430 AT1G75340 AT1G76850 AT1G76970 AT1G77140 AT1G79070 AT1G79450 AT1G80000 AT2G05170 AT2G06925 AT2G15290 AT2G19430 AT2G20790 AT2G27460 AT2G31020 AT2G32900 AT2G34840 AT2G36360 AT2G37840 AT2G38020 AT2G39380 AT2G44140 AT2G47450 AT2G47840 AT3G06540 AT3G09800 AT3G12400 AT3G15380 AT3G15920 AT3G16270 AT3G20320 AT3G23660 AT3G27070 AT3G44340 AT3G50860 AT3G55150 AT3G59950 AT3G60640 AT3G60860 AT4G02030 AT4G03320 AT4G14300 AT4G14600 AT4G16444 AT4G22540 AT4G23460 AT4G26750 AT4G27730 AT4G30790 AT4G30840 AT4G32160 AT4G32640 AT4G37130 AT4G38200 AT4G38350 AT4G38490 AT4G39170 AT5G09260 AT5G16210 AT5G17550 AT5G21990 AT5G22780 AT5G23550 AT5G24170 AT5G28750 AT5G37720 AT5G40930 AT5G43670 AT5G46150 AT5G49910 AT5G50230 AT5G51200 AT5G52990 AT5G55710 AT5G58440 AT5G59730 AT5G63880 AT5G64410 AT2G18840 AT2G36305 AT4G24500 AT1G03060 AT1G03840 AT1G54440 AT1G66340 AT1G79810 AT2G18250 AT4G03550 AT4G26850 AT5G03280 AT5G16000 AT5G44160 AT5G66850 AT4G21160 AT4G24230 AT5G53470"
8.90984067040055e-08,575,3286,"Developmental process ","AT1G05520 AT1G06180 AT1G12740 AT1G13620 AT1G14920 AT1G15550 AT1G18100 AT1G22770 AT1G28520 AT1G43850 AT1G61990 AT1G63820 AT1G65580 AT1G73340 AT1G78600 AT2G20130 AT2G21130 AT2G27550 AT2G32440 AT2G35110 AT2G35320 AT2G35612 AT2G36890 AT2G42400 AT2G46410 AT3G03450 AT3G05120 AT3G12280 AT3G23660 AT3G46550 AT3G55920 AT3G62020 AT3G63010 AT4G02560 AT4G02980 AT4G09460 AT4G09620 AT4G23640 AT4G25560 AT4G27060 AT4G28250 AT4G35390 AT4G35950 AT5G10280 AT5G14070 AT5G14750 AT5G15680 AT5G18410 AT5G26660 AT5G43670 AT5G57620 AT2G28250 AT2G28350 AT2G46340 AT5G39990 AT1G07630 AT1G08590 AT1G11760 AT1G12040 AT1G14350 AT1G15440 AT1G19520 AT1G21700 AT1G27320 AT1G28420 AT1G29290 AT1G32310 AT1G51190 AT1G52150 AT1G61040 AT1G62440 AT1G63700 AT1G68050 AT1G69270 AT1G71230 AT1G74720 AT1G76710 AT1G79200 AT1G79430 AT1G79580 AT1G79730 AT1G80940 AT2G01505 AT2G01830 AT2G06990 AT2G20562 AT2G22370 AT2G22840 AT2G23380 AT2G25930 AT2G26700 AT2G28890 AT2G31082 AT2G31960 AT2G33610 AT2G34140 AT2G34650 AT2G35230 AT2G35510 AT2G36740 AT2G36850 AT2G42160 AT2G42230 AT2G43410 AT2G44080 AT2G45400 AT2G46710 AT2G46920 AT2G47620 AT2G47790 AT2G47990 AT2G48160 AT3G02170 AT3G04240 AT3G04740 AT3G05970 AT3G07220 AT3G08850 AT3G10480 AT3G10490 AT3G11220 AT3G12680 AT3G15380 AT3G16440 AT3G20740 AT3G20840 AT3G22590 AT3G22990 AT3G23980 AT3G24440 AT3G26744 AT3G28455 AT3G33520 AT3G44735 AT3G47620 AT3G50870 AT3G52280 AT3G52910 AT3G54010 AT3G54430 AT3G60830 AT3G62300 AT4G00450 AT4G03550 AT4G04885 AT4G11280 AT4G14720 AT4G14770 AT4G15415 AT4G20270 AT4G24500 AT4G26430 AT4G28650 AT4G30580 AT4G30860 AT4G32880 AT4G34430 AT4G36920 AT4G37180 AT4G37740 AT5G12330 AT5G13300 AT5G13480 AT5G14530 AT5G16490 AT5G16560 AT5G19400 AT5G19740 AT5G22790 AT5G37055 AT5G37890 AT5G37930 AT5G39660 AT5G44180 AT5G55500 AT5G57360 AT5G60690 AT5G64070 AT5G64390 AT5G65640 AT1G64110 AT2G19450 AT2G22900 AT2G28950 AT2G43570 AT3G23630 AT3G27960 AT3G54180 AT3G54420 AT3G55850 AT4G10500 AT4G34410 AT5G51640 AT1G03060 AT1G03430 AT1G03840 AT1G08760 AT1G09100 AT1G15570 AT1G15940 AT1G16710 AT1G23380 AT1G31930 AT1G48550 AT1G60800 AT1G64990 AT1G65650 AT1G71040 AT1G71830 AT1G79000 AT1G80490 AT2G01930 AT2G02970 AT2G23950 AT2G31880 AT2G32950 AT2G39350 AT2G40750 AT3G01040 AT3G06930 AT3G12980 AT3G15880 AT3G16785 AT3G16830 AT3G21220 AT3G45590 AT3G52250 AT3G55510 AT3G57880 AT3G60800 AT4G08920 AT4G14220 AT4G14510 AT4G19180 AT4G22340 AT4G23410 AT4G24560 AT4G30980 AT4G31920 AT4G33240 AT4G34840 AT4G38350 AT5G03220 AT5G03280 AT5G03470 AT5G04340 AT5G04950 AT5G05700 AT5G06550 AT5G10170 AT5G10270 AT5G15470 AT5G37020 AT5G43270 AT5G43900 AT5G44160 AT5G45190 AT5G46760 AT5G53470 AT5G54380 AT5G55480 AT5G58440 AT5G66880 AT1G04950 AT1G05190 AT1G07640 AT1G08030 AT1G08260 AT1G08410 AT1G08600 AT1G08750 AT1G09700 AT1G09730 AT1G10130 AT1G12240 AT1G12560 AT1G13120 AT1G13300 AT1G15330 AT1G16280 AT1G16300 AT1G16340 AT1G16570 AT1G17110 AT1G17560 AT1G17690 AT1G18390 AT1G18580 AT1G19300 AT1G20823 AT1G20930 AT1G21070 AT1G22740 AT1G26830 AT1G26840 AT1G26910 AT1G28240 AT1G29940 AT1G31070 AT1G31420 AT1G32500 AT1G32930 AT1G36160 AT1G44900 AT1G47270 AT1G47550 AT1G48380 AT1G49040 AT1G49320 AT1G51170 AT1G53190 AT1G53500 AT1G54060 AT1G54130 AT1G54490 AT1G56180 AT1G56580 AT1G58340 AT1G60420 AT1G60490 AT1G64440 AT1G66340 AT1G66470 AT1G66740 AT1G66750 AT1G67120 AT1G67140 AT1G67360 AT1G67580 AT1G69770 AT1G71090 AT1G71400 AT1G71800 AT1G72440 AT1G73430 AT1G73980 AT1G75390 AT1G75410 AT1G77300 AT1G78240 AT1G79810 AT1G80350 AT2G01210 AT2G01735 AT2G01820 AT2G01850 AT2G02480 AT2G02560 AT2G02810 AT2G03070 AT2G04550 AT2G13540 AT2G15430 AT2G15690 AT2G17870 AT2G19560 AT2G20000 AT2G20190 AT2G21150 AT2G21470 AT2G22250 AT2G22300 AT2G22420 AT2G22640 AT2G24060 AT2G26170 AT2G27460 AT2G28620 AT2G30130 AT2G30140 AT2G30330 AT2G31270 AT2G31305 AT2G34570 AT2G34720 AT2G35020 AT2G35270 AT2G35620 AT2G35940 AT2G37430 AT2G37620 AT2G37690 AT2G38020 AT2G38440 AT2G38620 AT2G39810 AT2G39940 AT2G41060 AT2G41500 AT2G42080 AT2G42280 AT2G48140 AT3G01150 AT3G01780 AT3G02860 AT3G03690 AT3G03773 AT3G03810 AT3G04680 AT3G05010 AT3G05040 AT3G05090 AT3G05680 AT3G06440 AT3G06810 AT3G07130 AT3G07650 AT3G09090 AT3G10160 AT3G10380 AT3G10500 AT3G11270 AT3G11964 AT3G12400 AT3G12700 AT3G13490 AT3G14180 AT3G15010 AT3G15070 AT3G16810 AT3G20550 AT3G21200 AT3G21640 AT3G23090 AT3G23580 AT3G24880 AT3G26640 AT3G27560 AT3G27750 AT3G29810 AT3G44600 AT3G44680 AT3G45040 AT3G45100 AT3G46740 AT3G48090 AT3G48330 AT3G48430 AT3G48820 AT3G49180 AT3G50590 AT3G51390 AT3G51630 AT3G51770 AT3G52150 AT3G52430 AT3G52860 AT3G53180 AT3G53900 AT3G54170 AT3G55200 AT3G55370 AT3G55400 AT3G55490 AT3G56930 AT3G56990 AT3G57300 AT3G61650 AT3G62770 AT4G00060 AT4G00231 AT4G00990 AT4G01430 AT4G01630 AT4G02030 AT4G02350 AT4G04040 AT4G05440 AT4G05450 AT4G09140 AT4G11850 AT4G14040 AT4G14147 AT4G14300 AT4G15180 AT4G15880 AT4G16444 AT4G19040 AT4G20780 AT4G21540 AT4G21800 AT4G23810 AT4G25050 AT4G25320 AT4G26750 AT4G27950 AT4G28980 AT4G30790 AT4G33210 AT4G33980 AT4G34100 AT4G34540 AT4G35600 AT4G35910 AT4G36480 AT4G36810 AT4G38490 AT5G02310 AT5G02410 AT5G02600 AT5G02820 AT5G03730 AT5G04920 AT5G04990 AT5G05340 AT5G05620 AT5G06160 AT5G06780 AT5G06839 AT5G09680 AT5G12080 AT5G12130 AT5G13570 AT5G14220 AT5G14930 AT5G16000 AT5G16260 AT5G16750 AT5G16910 AT5G17400 AT5G18830 AT5G19280 AT5G22290 AT5G22640 AT5G23080 AT5G24630 AT5G24710 AT5G27150 AT5G27540 AT5G35700 AT5G37260 AT5G37850 AT5G40280 AT5G42390 AT5G42810 AT5G45710 AT5G45800 AT5G45940 AT5G47640 AT5G48030 AT5G48150 AT5G48300 AT5G48600 AT5G49160 AT5G49665 AT5G51060 AT5G51340 AT5G51590 AT5G53180 AT5G53860 AT5G55630 AT5G55820 AT5G56580 AT5G57280 AT5G58100 AT5G59570 AT5G62000 AT5G63110 AT5G63220 AT5G63780 AT5G64340 AT5G64610 AT5G64930 AT5G65000 AT5G65530 AT5G65683 AT5G66100 AT5G66730 AT5G67100 AT1G32440 AT4G13395 AT5G59510 AT1G30825 AT2G20610 AT3G01640"
1.09551032378495e-07,174,800,"Cellular macromolecule localization ","AT1G02690 AT1G03360 AT1G05810 AT1G06950 AT1G08350 AT1G08750 AT1G10180 AT1G10390 AT1G11905 AT1G13120 AT1G14850 AT1G22740 AT1G24310 AT1G27700 AT1G30900 AT1G47270 AT1G47550 AT1G48240 AT1G48550 AT1G53530 AT1G55130 AT1G55900 AT1G65040 AT1G69420 AT1G73790 AT1G75850 AT2G01110 AT2G13540 AT2G14255 AT2G14740 AT2G16900 AT2G16950 AT2G18240 AT2G19560 AT2G20960 AT2G24170 AT2G25355 AT2G30710 AT2G31660 AT2G31680 AT2G36680 AT2G39280 AT2G41620 AT2G43130 AT2G46520 AT3G02460 AT3G02950 AT3G04770 AT3G05040 AT3G05710 AT3G07410 AT3G07890 AT3G09700 AT3G10380 AT3G10650 AT3G11820 AT3G13860 AT3G14120 AT3G15060 AT3G15980 AT3G17340 AT3G24350 AT3G49350 AT3G49590 AT3G49990 AT3G51310 AT3G51390 AT3G53230 AT3G54380 AT3G54826 AT3G56930 AT3G60800 AT3G62770 AT3G62880 AT4G00840 AT4G01730 AT4G02150 AT4G05000 AT4G08320 AT4G15080 AT4G17140 AT4G18430 AT4G18800 AT4G20110 AT4G24630 AT4G26780 AT4G27040 AT4G27690 AT4G29950 AT4G38760 AT5G02200 AT5G03030 AT5G04920 AT5G09860 AT5G15930 AT5G16280 AT5G16620 AT5G17060 AT5G27280 AT5G35520 AT5G42920 AT5G47480 AT5G47520 AT5G49830 AT5G50020 AT5G55200 AT5G55510 AT5G56130 AT5G56290 AT5G61880 AT5G62500 AT5G63220 AT5G64090 AT5G65270 AT5G67270 AT1G63900 AT2G38410 AT3G04340 AT3G12360 AT3G46740 AT5G04990 AT5G22640 AT5G52440 AT5G55500 ATCG00860 AT1G02280 AT1G04070 AT1G05520 AT1G05960 AT1G08190 AT1G13160 AT1G23900 AT1G56590 AT1G73430 AT1G76970 AT1G79070 AT2G05170 AT2G20790 AT2G27460 AT2G36360 AT2G38020 AT2G47450 AT3G06540 AT3G16270 AT3G23660 AT3G27070 AT3G44340 AT3G50860 AT4G16444 AT4G23460 AT4G32640 AT4G38490 AT5G22780 AT5G40930 AT5G43670 AT1G77140 AT2G36305 AT5G17550 AT1G03060 AT1G03840 AT1G33410 AT1G66340 AT1G79810 AT2G15290 AT2G32900 AT3G60860 AT4G03320 AT4G03550 AT4G26850 AT5G03280 AT5G16000 AT5G44160 AT5G49910 AT4G21160"
