"Enrichment FDR","Genes in list","Total genes","Functional Category","Genes"
3.45631639402148e-18,693,3092,"Cellular protein modification process ","AT1G03740 AT1G03930 AT1G04440 AT1G04640 AT1G04860 AT1G04870 AT1G05170 AT1G05180 AT1G05350 AT1G05890 AT1G06700 AT1G10450 AT1G11050 AT1G11130 AT1G11330 AT1G11350 AT1G12580 AT1G14030 AT1G15390 AT1G15860 AT1G16560 AT1G16890 AT1G17230 AT1G17280 AT1G17440 AT1G18890 AT1G20540 AT1G20650 AT1G21590 AT1G21770 AT1G22920 AT1G24190 AT1G24610 AT1G27330 AT1G27530 AT1G28120 AT1G29750 AT1G30270 AT1G30570 AT1G31340 AT1G32210 AT1G34210 AT1G35670 AT1G47570 AT1G48210 AT1G48490 AT1G48790 AT1G49580 AT1G49730 AT1G50670 AT1G51660 AT1G52290 AT1G52310 AT1G53050 AT1G53290 AT1G53570 AT1G53730 AT1G54820 AT1G55530 AT1G56120 AT1G57820 AT1G59890 AT1G60490 AT1G61380 AT1G61430 AT1G63110 AT1G65430 AT1G65650 AT1G67490 AT1G67580 AT1G69220 AT1G70210 AT1G72180 AT1G73080 AT1G73500 AT1G75270 AT1G78290 AT1G78800 AT1G78870 AT1G80870 AT2G01950 AT2G04550 AT2G11520 AT2G17720 AT2G19470 AT2G20300 AT2G20330 AT2G20850 AT2G21470 AT2G22490 AT2G23200 AT2G26430 AT2G27350 AT2G30040 AT2G30740 AT2G31510 AT2G32850 AT2G33170 AT2G33540 AT2G35610 AT2G35620 AT2G35635 AT2G36060 AT2G38025 AT2G39720 AT2G40330 AT2G40830 AT2G41820 AT2G41890 AT2G44830 AT2G47060 AT2G47210 AT3G01090 AT3G01320 AT3G02130 AT3G04480 AT3G05050 AT3G05090 AT3G06930 AT3G07140 AT3G07610 AT3G09880 AT3G11800 AT3G12270 AT3G12760 AT3G15220 AT3G16090 AT3G17205 AT3G17410 AT3G17510 AT3G19950 AT3G20410 AT3G20630 AT3G21220 AT3G21530 AT3G25560 AT3G26020 AT3G26935 AT3G29160 AT3G44600 AT3G46290 AT3G48070 AT3G48750 AT3G48760 AT3G49600 AT3G51630 AT3G52890 AT3G53240 AT3G54010 AT3G55380 AT3G55520 AT3G56760 AT3G57810 AT3G59110 AT3G59350 AT3G60250 AT3G61960 AT3G62770 AT3G62940 AT4G00990 AT4G01330 AT4G02010 AT4G02630 AT4G04570 AT4G04740 AT4G08480 AT4G08500 AT4G09570 AT4G10730 AT4G11460 AT4G11860 AT4G14340 AT4G14350 AT4G15415 AT4G15880 AT4G16420 AT4G17270 AT4G17510 AT4G17640 AT4G19600 AT4G19670 AT4G21670 AT4G22130 AT4G23250 AT4G23260 AT4G23270 AT4G24400 AT4G24490 AT4G24560 AT4G24940 AT4G26100 AT4G26400 AT4G26540 AT4G26610 AT4G28540 AT4G28860 AT4G28980 AT4G29380 AT4G29510 AT4G29810 AT4G29940 AT4G30790 AT4G30825 AT4G31120 AT4G32300 AT4G32710 AT4G33430 AT4G34020 AT4G34160 AT4G34370 AT4G36180 AT4G37280 AT4G38240 AT4G39910 AT5G01270 AT5G01770 AT5G01890 AT5G05560 AT5G05700 AT5G06150 AT5G06460 AT5G06830 AT5G07180 AT5G08415 AT5G09890 AT5G10290 AT5G10380 AT5G11340 AT5G12210 AT5G12480 AT5G13160 AT5G14950 AT5G15020 AT5G16000 AT5G17290 AT5G17600 AT5G18610 AT5G18940 AT5G19130 AT5G19180 AT5G19450 AT5G20050 AT5G20570 AT5G20620 AT5G22330 AT5G25510 AT5G26760 AT5G28850 AT5G28900 AT5G38560 AT5G40380 AT5G41360 AT5G41370 AT5G44090 AT5G44100 AT5G45190 AT5G46330 AT5G46790 AT5G47080 AT5G47540 AT5G47750 AT5G48630 AT5G49020 AT5G50020 AT5G51040 AT5G51880 AT5G53450 AT5G55160 AT5G56340 AT5G56740 AT5G56790 AT5G57015 AT5G58350 AT5G58450 AT5G61480 AT5G63110 AT5G63610 AT5G66060 AT5G66850 AT5G66880 AT5G67320 AT5G67530 AT5G67630 AT1G08680 AT1G21410 AT1G22280 AT1G27910 AT1G49540 AT1G49780 AT1G59580 AT1G60220 AT1G71020 AT1G79810 AT2G23740 AT2G35930 AT2G39000 AT2G39660 AT2G39810 AT2G41980 AT2G43790 AT2G44950 AT3G01460 AT3G07360 AT3G09970 AT3G14980 AT3G19980 AT3G21630 AT3G25070 AT3G45240 AT3G58030 AT3G58040 AT4G12720 AT4G14220 AT4G20400 AT4G24740 AT4G32660 AT4G33470 AT5G03455 AT5G07270 AT5G11860 AT5G14640 AT5G18650 AT5G36250 AT5G42400 AT5G45360 AT5G45800 AT5G46410 AT5G50860 AT5G55500 AT5G60550 AT5G64920 AT1G02100 AT1G03365 AT1G03590 AT1G04910 AT1G05830 AT1G06110 AT1G07570 AT1G08620 AT1G08660 AT1G09160 AT1G09840 AT1G10430 AT1G10650 AT1G10850 AT1G12460 AT1G12760 AT1G12820 AT1G12990 AT1G13270 AT1G13350 AT1G15740 AT1G16270 AT1G16710 AT1G16900 AT1G17550 AT1G18150 AT1G18160 AT1G18170 AT1G20780 AT1G20810 AT1G20823 AT1G21780 AT1G23780 AT1G25280 AT1G25390 AT1G27190 AT1G27340 AT1G27520 AT1G30000 AT1G30810 AT1G31810 AT1G35510 AT1G38131 AT1G43900 AT1G47200 AT1G47380 AT1G48120 AT1G49710 AT1G50240 AT1G50370 AT1G50490 AT1G51590 AT1G51940 AT1G53780 AT1G55000 AT1G55250 AT1G59830 AT1G61040 AT1G61620 AT1G62330 AT1G63170 AT1G63430 AT1G63490 AT1G63500 AT1G63800 AT1G64040 AT1G64280 AT1G65410 AT1G66340 AT1G66680 AT1G66830 AT1G67340 AT1G67470 AT1G67890 AT1G68050 AT1G68400 AT1G68410 AT1G69670 AT1G69960 AT1G71410 AT1G71860 AT1G71990 AT1G72300 AT1G73100 AT1G73460 AT1G73670 AT1G76360 AT1G76570 AT1G76920 AT1G77550 AT1G78100 AT1G78200 AT1G79110 AT1G79380 AT1G79730 AT2G01620 AT2G02220 AT2G02710 AT2G02800 AT2G02870 AT2G04740 AT2G07180 AT2G11000 AT2G14740 AT2G15530 AT2G15580 AT2G16920 AT2G17220 AT2G17520 AT2G17530 AT2G17820 AT2G20000 AT2G20370 AT2G23140 AT2G23450 AT2G23780 AT2G24990 AT2G25050 AT2G25070 AT2G26980 AT2G27060 AT2G27210 AT2G28890 AT2G28930 AT2G29960 AT2G30695 AT2G33700 AT2G36570 AT2G38950 AT2G39760 AT2G39940 AT2G40270 AT2G40860 AT2G40930 AT2G42030 AT2G42620 AT2G42810 AT2G44410 AT2G45240 AT2G45590 AT2G45910 AT2G45950 AT2G46260 AT2G47700 AT3G01200 AT3G01490 AT3G01510 AT3G02880 AT3G03740 AT3G04580 AT3G04810 AT3G06190 AT3G06330 AT3G06380 AT3G07180 AT3G08020 AT3G08680 AT3G08690 AT3G09770 AT3G09830 AT3G10810 AT3G10940 AT3G11410 AT3G11540 AT3G12200 AT3G12400 AT3G12620 AT3G12920 AT3G12980 AT3G14720 AT3G15260 AT3G16560 AT3G17000 AT3G17750 AT3G18040 AT3G18520 AT3G19910 AT3G20060 AT3G20740 AT3G21160 AT3G21870 AT3G22104 AT3G23150 AT3G23280 AT3G25220 AT3G26000 AT3G26810 AT3G28690 AT3G29350 AT3G30300 AT3G44200 AT3G44620 AT3G44750 AT3G46590 AT3G46820 AT3G48190 AT3G48430 AT3G48530 AT3G49060 AT3G51270 AT3G51740 AT3G51770 AT3G53380 AT3G54350 AT3G54480 AT3G54650 AT3G54790 AT3G55050 AT3G55070 AT3G55830 AT3G55960 AT3G57630 AT3G57830 AT3G60080 AT3G60370 AT3G61140 AT3G61740 AT3G62260 AT3G63120 AT3G63400 AT3G66654 AT4G00330 AT4G02420 AT4G02440 AT4G06599 AT4G08960 AT4G10570 AT4G10590 AT4G11110 AT4G11240 AT4G11680 AT4G12020 AT4G12560 AT4G13020 AT4G13460 AT4G14110 AT4G14365 AT4G16580 AT4G16650 AT4G17070 AT4G18950 AT4G19700 AT4G20940 AT4G21100 AT4G22290 AT4G22350 AT4G23860 AT4G24810 AT4G25230 AT4G25340 AT4G26555 AT4G26720 AT4G28400 AT4G31170 AT4G31820 AT4G31860 AT4G32250 AT4G33260 AT4G33920 AT4G35780 AT4G37880 AT4G38040 AT4G38470 AT4G39710 AT5G01290 AT5G01720 AT5G01820 AT5G01950 AT5G02880 AT5G03140 AT5G03320 AT5G04240 AT5G04540 AT5G04670 AT5G05080 AT5G05660 AT5G08160 AT5G09230 AT5G10020 AT5G11850 AT5G13410 AT5G13840 AT5G14420 AT5G16590 AT5G16810 AT5G18525 AT5G18700 AT5G19010 AT5G19280 AT5G19680 AT5G22030 AT5G22920 AT5G24360 AT5G24850 AT5G24870 AT5G27840 AT5G35570 AT5G35750 AT5G35840 AT5G41260 AT5G42940 AT5G43020 AT5G45110 AT5G46570 AT5G47070 AT5G48380 AT5G48580 AT5G49660 AT5G50180 AT5G50320 AT5G50420 AT5G50870 AT5G51560 AT5G53430 AT5G55130 AT5G56280 AT5G57610 AT5G58160 AT5G58300 AT5G58380 AT5G58410 AT5G59010 AT5G59160 AT5G59670 AT5G61060 AT5G61840 AT5G62220 AT5G63160 AT5G63870 AT5G64610 AT5G65470 AT5G65860 AT5G65920 AT5G66560 AT5G67250 AT5G67280 AT5G67440 AT5G67480 ATCG00270 ATCG00680 AT1G69770 AT1G02090 AT1G09730 AT1G14350 AT1G62830 AT2G26990 AT3G10390 AT3G10480 AT3G10490 AT3G24140 AT3G24440 AT3G24870 AT3G24880 AT4G00830 AT4G22140 AT4G29830 AT4G39100 AT5G11530 AT5G14250 AT5G22010 AT5G42970 AT5G55390"
3.45631639402148e-18,693,3092,"Protein modification process ","AT1G03740 AT1G03930 AT1G04440 AT1G04640 AT1G04860 AT1G04870 AT1G05170 AT1G05180 AT1G05350 AT1G05890 AT1G06700 AT1G10450 AT1G11050 AT1G11130 AT1G11330 AT1G11350 AT1G12580 AT1G14030 AT1G15390 AT1G15860 AT1G16560 AT1G16890 AT1G17230 AT1G17280 AT1G17440 AT1G18890 AT1G20540 AT1G20650 AT1G21590 AT1G21770 AT1G22920 AT1G24190 AT1G24610 AT1G27330 AT1G27530 AT1G28120 AT1G29750 AT1G30270 AT1G30570 AT1G31340 AT1G32210 AT1G34210 AT1G35670 AT1G47570 AT1G48210 AT1G48490 AT1G48790 AT1G49580 AT1G49730 AT1G50670 AT1G51660 AT1G52290 AT1G52310 AT1G53050 AT1G53290 AT1G53570 AT1G53730 AT1G54820 AT1G55530 AT1G56120 AT1G57820 AT1G59890 AT1G60490 AT1G61380 AT1G61430 AT1G63110 AT1G65430 AT1G65650 AT1G67490 AT1G67580 AT1G69220 AT1G70210 AT1G72180 AT1G73080 AT1G73500 AT1G75270 AT1G78290 AT1G78800 AT1G78870 AT1G80870 AT2G01950 AT2G04550 AT2G11520 AT2G17720 AT2G19470 AT2G20300 AT2G20330 AT2G20850 AT2G21470 AT2G22490 AT2G23200 AT2G26430 AT2G27350 AT2G30040 AT2G30740 AT2G31510 AT2G32850 AT2G33170 AT2G33540 AT2G35610 AT2G35620 AT2G35635 AT2G36060 AT2G38025 AT2G39720 AT2G40330 AT2G40830 AT2G41820 AT2G41890 AT2G44830 AT2G47060 AT2G47210 AT3G01090 AT3G01320 AT3G02130 AT3G04480 AT3G05050 AT3G05090 AT3G06930 AT3G07140 AT3G07610 AT3G09880 AT3G11800 AT3G12270 AT3G12760 AT3G15220 AT3G16090 AT3G17205 AT3G17410 AT3G17510 AT3G19950 AT3G20410 AT3G20630 AT3G21220 AT3G21530 AT3G25560 AT3G26020 AT3G26935 AT3G29160 AT3G44600 AT3G46290 AT3G48070 AT3G48750 AT3G48760 AT3G49600 AT3G51630 AT3G52890 AT3G53240 AT3G54010 AT3G55380 AT3G55520 AT3G56760 AT3G57810 AT3G59110 AT3G59350 AT3G60250 AT3G61960 AT3G62770 AT3G62940 AT4G00990 AT4G01330 AT4G02010 AT4G02630 AT4G04570 AT4G04740 AT4G08480 AT4G08500 AT4G09570 AT4G10730 AT4G11460 AT4G11860 AT4G14340 AT4G14350 AT4G15415 AT4G15880 AT4G16420 AT4G17270 AT4G17510 AT4G17640 AT4G19600 AT4G19670 AT4G21670 AT4G22130 AT4G23250 AT4G23260 AT4G23270 AT4G24400 AT4G24490 AT4G24560 AT4G24940 AT4G26100 AT4G26400 AT4G26540 AT4G26610 AT4G28540 AT4G28860 AT4G28980 AT4G29380 AT4G29510 AT4G29810 AT4G29940 AT4G30790 AT4G30825 AT4G31120 AT4G32300 AT4G32710 AT4G33430 AT4G34020 AT4G34160 AT4G34370 AT4G36180 AT4G37280 AT4G38240 AT4G39910 AT5G01270 AT5G01770 AT5G01890 AT5G05560 AT5G05700 AT5G06150 AT5G06460 AT5G06830 AT5G07180 AT5G08415 AT5G09890 AT5G10290 AT5G10380 AT5G11340 AT5G12210 AT5G12480 AT5G13160 AT5G14950 AT5G15020 AT5G16000 AT5G17290 AT5G17600 AT5G18610 AT5G18940 AT5G19130 AT5G19180 AT5G19450 AT5G20050 AT5G20570 AT5G20620 AT5G22330 AT5G25510 AT5G26760 AT5G28850 AT5G28900 AT5G38560 AT5G40380 AT5G41360 AT5G41370 AT5G44090 AT5G44100 AT5G45190 AT5G46330 AT5G46790 AT5G47080 AT5G47540 AT5G47750 AT5G48630 AT5G49020 AT5G50020 AT5G51040 AT5G51880 AT5G53450 AT5G55160 AT5G56340 AT5G56740 AT5G56790 AT5G57015 AT5G58350 AT5G58450 AT5G61480 AT5G63110 AT5G63610 AT5G66060 AT5G66850 AT5G66880 AT5G67320 AT5G67530 AT5G67630 AT1G08680 AT1G21410 AT1G22280 AT1G27910 AT1G49540 AT1G49780 AT1G59580 AT1G60220 AT1G71020 AT1G79810 AT2G23740 AT2G35930 AT2G39000 AT2G39660 AT2G39810 AT2G41980 AT2G43790 AT2G44950 AT3G01460 AT3G07360 AT3G09970 AT3G14980 AT3G19980 AT3G21630 AT3G25070 AT3G45240 AT3G58030 AT3G58040 AT4G12720 AT4G14220 AT4G20400 AT4G24740 AT4G32660 AT4G33470 AT5G03455 AT5G07270 AT5G11860 AT5G14640 AT5G18650 AT5G36250 AT5G42400 AT5G45360 AT5G45800 AT5G46410 AT5G50860 AT5G55500 AT5G60550 AT5G64920 AT1G02100 AT1G03365 AT1G03590 AT1G04910 AT1G05830 AT1G06110 AT1G07570 AT1G08620 AT1G08660 AT1G09160 AT1G09840 AT1G10430 AT1G10650 AT1G10850 AT1G12460 AT1G12760 AT1G12820 AT1G12990 AT1G13270 AT1G13350 AT1G15740 AT1G16270 AT1G16710 AT1G16900 AT1G17550 AT1G18150 AT1G18160 AT1G18170 AT1G20780 AT1G20810 AT1G20823 AT1G21780 AT1G23780 AT1G25280 AT1G25390 AT1G27190 AT1G27340 AT1G27520 AT1G30000 AT1G30810 AT1G31810 AT1G35510 AT1G38131 AT1G43900 AT1G47200 AT1G47380 AT1G48120 AT1G49710 AT1G50240 AT1G50370 AT1G50490 AT1G51590 AT1G51940 AT1G53780 AT1G55000 AT1G55250 AT1G59830 AT1G61040 AT1G61620 AT1G62330 AT1G63170 AT1G63430 AT1G63490 AT1G63500 AT1G63800 AT1G64040 AT1G64280 AT1G65410 AT1G66340 AT1G66680 AT1G66830 AT1G67340 AT1G67470 AT1G67890 AT1G68050 AT1G68400 AT1G68410 AT1G69670 AT1G69960 AT1G71410 AT1G71860 AT1G71990 AT1G72300 AT1G73100 AT1G73460 AT1G73670 AT1G76360 AT1G76570 AT1G76920 AT1G77550 AT1G78100 AT1G78200 AT1G79110 AT1G79380 AT1G79730 AT2G01620 AT2G02220 AT2G02710 AT2G02800 AT2G02870 AT2G04740 AT2G07180 AT2G11000 AT2G14740 AT2G15530 AT2G15580 AT2G16920 AT2G17220 AT2G17520 AT2G17530 AT2G17820 AT2G20000 AT2G20370 AT2G23140 AT2G23450 AT2G23780 AT2G24990 AT2G25050 AT2G25070 AT2G26980 AT2G27060 AT2G27210 AT2G28890 AT2G28930 AT2G29960 AT2G30695 AT2G33700 AT2G36570 AT2G38950 AT2G39760 AT2G39940 AT2G40270 AT2G40860 AT2G40930 AT2G42030 AT2G42620 AT2G42810 AT2G44410 AT2G45240 AT2G45590 AT2G45910 AT2G45950 AT2G46260 AT2G47700 AT3G01200 AT3G01490 AT3G01510 AT3G02880 AT3G03740 AT3G04580 AT3G04810 AT3G06190 AT3G06330 AT3G06380 AT3G07180 AT3G08020 AT3G08680 AT3G08690 AT3G09770 AT3G09830 AT3G10810 AT3G10940 AT3G11410 AT3G11540 AT3G12200 AT3G12400 AT3G12620 AT3G12920 AT3G12980 AT3G14720 AT3G15260 AT3G16560 AT3G17000 AT3G17750 AT3G18040 AT3G18520 AT3G19910 AT3G20060 AT3G20740 AT3G21160 AT3G21870 AT3G22104 AT3G23150 AT3G23280 AT3G25220 AT3G26000 AT3G26810 AT3G28690 AT3G29350 AT3G30300 AT3G44200 AT3G44620 AT3G44750 AT3G46590 AT3G46820 AT3G48190 AT3G48430 AT3G48530 AT3G49060 AT3G51270 AT3G51740 AT3G51770 AT3G53380 AT3G54350 AT3G54480 AT3G54650 AT3G54790 AT3G55050 AT3G55070 AT3G55830 AT3G55960 AT3G57630 AT3G57830 AT3G60080 AT3G60370 AT3G61140 AT3G61740 AT3G62260 AT3G63120 AT3G63400 AT3G66654 AT4G00330 AT4G02420 AT4G02440 AT4G06599 AT4G08960 AT4G10570 AT4G10590 AT4G11110 AT4G11240 AT4G11680 AT4G12020 AT4G12560 AT4G13020 AT4G13460 AT4G14110 AT4G14365 AT4G16580 AT4G16650 AT4G17070 AT4G18950 AT4G19700 AT4G20940 AT4G21100 AT4G22290 AT4G22350 AT4G23860 AT4G24810 AT4G25230 AT4G25340 AT4G26555 AT4G26720 AT4G28400 AT4G31170 AT4G31820 AT4G31860 AT4G32250 AT4G33260 AT4G33920 AT4G35780 AT4G37880 AT4G38040 AT4G38470 AT4G39710 AT5G01290 AT5G01720 AT5G01820 AT5G01950 AT5G02880 AT5G03140 AT5G03320 AT5G04240 AT5G04540 AT5G04670 AT5G05080 AT5G05660 AT5G08160 AT5G09230 AT5G10020 AT5G11850 AT5G13410 AT5G13840 AT5G14420 AT5G16590 AT5G16810 AT5G18525 AT5G18700 AT5G19010 AT5G19280 AT5G19680 AT5G22030 AT5G22920 AT5G24360 AT5G24850 AT5G24870 AT5G27840 AT5G35570 AT5G35750 AT5G35840 AT5G41260 AT5G42940 AT5G43020 AT5G45110 AT5G46570 AT5G47070 AT5G48380 AT5G48580 AT5G49660 AT5G50180 AT5G50320 AT5G50420 AT5G50870 AT5G51560 AT5G53430 AT5G55130 AT5G56280 AT5G57610 AT5G58160 AT5G58300 AT5G58380 AT5G58410 AT5G59010 AT5G59160 AT5G59670 AT5G61060 AT5G61840 AT5G62220 AT5G63160 AT5G63870 AT5G64610 AT5G65470 AT5G65860 AT5G65920 AT5G66560 AT5G67250 AT5G67280 AT5G67440 AT5G67480 ATCG00270 ATCG00680 AT1G69770 AT1G02090 AT1G09730 AT1G14350 AT1G62830 AT2G26990 AT3G10390 AT3G10480 AT3G10490 AT3G24140 AT3G24440 AT3G24870 AT3G24880 AT4G00830 AT4G22140 AT4G29830 AT4G39100 AT5G11530 AT5G14250 AT5G22010 AT5G42970 AT5G55390"
9.64477745188366e-18,976,4644,"Protein metabolic process ","AT1G01650 AT1G02300 AT1G03230 AT1G03740 AT1G03930 AT1G04440 AT1G04640 AT1G04860 AT1G04870 AT1G05170 AT1G05180 AT1G05350 AT1G05840 AT1G05890 AT1G06700 AT1G06870 AT1G07705 AT1G08210 AT1G09150 AT1G09850 AT1G10450 AT1G11050 AT1G11080 AT1G11130 AT1G11330 AT1G11350 AT1G12580 AT1G12820 AT1G13120 AT1G14030 AT1G15000 AT1G15270 AT1G15390 AT1G15740 AT1G15860 AT1G16470 AT1G16560 AT1G16890 AT1G17230 AT1G17280 AT1G17440 AT1G18890 AT1G20540 AT1G20650 AT1G20850 AT1G21410 AT1G21590 AT1G21720 AT1G21770 AT1G22920 AT1G23440 AT1G24190 AT1G24610 AT1G27330 AT1G27340 AT1G27530 AT1G28120 AT1G28320 AT1G29750 AT1G30000 AT1G30270 AT1G30570 AT1G31340 AT1G31817 AT1G32210 AT1G32360 AT1G33360 AT1G34210 AT1G34570 AT1G35670 AT1G47570 AT1G47710 AT1G48210 AT1G48490 AT1G48790 AT1G49580 AT1G49730 AT1G50490 AT1G50670 AT1G51590 AT1G51660 AT1G51730 AT1G52290 AT1G52310 AT1G52600 AT1G53050 AT1G53290 AT1G53570 AT1G53730 AT1G54820 AT1G55530 AT1G56120 AT1G56700 AT1G57820 AT1G59890 AT1G60490 AT1G61380 AT1G61430 AT1G63110 AT1G63800 AT1G65430 AT1G65650 AT1G66530 AT1G67490 AT1G67580 AT1G69220 AT1G69670 AT1G70210 AT1G71350 AT1G71696 AT1G72180 AT1G73080 AT1G73500 AT1G75270 AT1G75990 AT1G77440 AT1G77480 AT1G78290 AT1G78800 AT1G78870 AT1G79210 AT1G79650 AT1G79720 AT1G80870 AT2G01950 AT2G04550 AT2G11520 AT2G14740 AT2G15580 AT2G17720 AT2G17760 AT2G19470 AT2G19740 AT2G20300 AT2G20330 AT2G20850 AT2G21290 AT2G21470 AT2G22490 AT2G23200 AT2G23780 AT2G26430 AT2G26590 AT2G27350 AT2G30040 AT2G30740 AT2G31170 AT2G31510 AT2G32070 AT2G32850 AT2G33170 AT2G33540 AT2G35610 AT2G35620 AT2G35635 AT2G36060 AT2G37600 AT2G38025 AT2G39140 AT2G39720 AT2G39940 AT2G39960 AT2G40330 AT2G40660 AT2G40830 AT2G41820 AT2G41890 AT2G42030 AT2G42620 AT2G42710 AT2G43070 AT2G43760 AT2G44065 AT2G44410 AT2G44830 AT2G45030 AT2G47060 AT2G47210 AT2G47970 AT3G01090 AT3G01320 AT3G01790 AT3G02110 AT3G02130 AT3G02740 AT3G04480 AT3G04600 AT3G05050 AT3G05090 AT3G06700 AT3G06930 AT3G07140 AT3G07610 AT3G09880 AT3G11800 AT3G12270 AT3G12760 AT3G14290 AT3G15220 AT3G16090 AT3G17000 AT3G17205 AT3G17410 AT3G17510 AT3G19950 AT3G20060 AT3G20410 AT3G20630 AT3G20800 AT3G21160 AT3G21220 AT3G21530 AT3G22630 AT3G24590 AT3G25560 AT3G26020 AT3G26618 AT3G26810 AT3G26935 AT3G27110 AT3G29160 AT3G44600 AT3G45310 AT3G46290 AT3G48070 AT3G48750 AT3G48760 AT3G49600 AT3G51630 AT3G52640 AT3G52890 AT3G53230 AT3G53240 AT3G53970 AT3G54010 AT3G54650 AT3G55070 AT3G55380 AT3G55520 AT3G56760 AT3G57340 AT3G57810 AT3G58030 AT3G59080 AT3G59110 AT3G59350 AT3G60080 AT3G60250 AT3G61960 AT3G62770 AT3G62940 AT3G63000 AT4G00990 AT4G01320 AT4G01330 AT4G02010 AT4G02630 AT4G04210 AT4G04570 AT4G04740 AT4G08480 AT4G08500 AT4G09570 AT4G10730 AT4G11120 AT4G11460 AT4G11860 AT4G14340 AT4G14350 AT4G14800 AT4G15410 AT4G15415 AT4G15880 AT4G16420 AT4G17270 AT4G17510 AT4G17640 AT4G19006 AT4G19600 AT4G19670 AT4G21100 AT4G21670 AT4G22130 AT4G23250 AT4G23260 AT4G23270 AT4G24400 AT4G24490 AT4G24560 AT4G24940 AT4G25230 AT4G25910 AT4G26100 AT4G26400 AT4G26540 AT4G26610 AT4G27040 AT4G28540 AT4G28860 AT4G28980 AT4G29380 AT4G29510 AT4G29810 AT4G29940 AT4G30790 AT4G30825 AT4G31120 AT4G32300 AT4G32710 AT4G33410 AT4G33430 AT4G33490 AT4G34020 AT4G34160 AT4G34370 AT4G35490 AT4G36180 AT4G36190 AT4G37280 AT4G37880 AT4G38240 AT4G39880 AT4G39910 AT5G01270 AT5G01720 AT5G01770 AT5G01890 AT5G02050 AT5G04920 AT5G05080 AT5G05560 AT5G05700 AT5G06150 AT5G06460 AT5G06830 AT5G07180 AT5G08100 AT5G08415 AT5G09890 AT5G09920 AT5G10290 AT5G10380 AT5G10770 AT5G11340 AT5G11900 AT5G12210 AT5G12480 AT5G12980 AT5G13160 AT5G14250 AT5G14950 AT5G15020 AT5G16000 AT5G17290 AT5G17600 AT5G18610 AT5G18940 AT5G19130 AT5G19180 AT5G19450 AT5G20050 AT5G20570 AT5G20620 AT5G22330 AT5G22850 AT5G23140 AT5G23210 AT5G25510 AT5G25780 AT5G26760 AT5G26860 AT5G27430 AT5G28850 AT5G28900 AT5G35430 AT5G38560 AT5G39850 AT5G40380 AT5G40580 AT5G41360 AT5G41370 AT5G42240 AT5G43010 AT5G43060 AT5G43100 AT5G44090 AT5G44100 AT5G45190 AT5G45620 AT5G46330 AT5G46790 AT5G47080 AT5G47540 AT5G47750 AT5G48630 AT5G49020 AT5G49840 AT5G49930 AT5G50020 AT5G51040 AT5G51880 AT5G53330 AT5G53450 AT5G55160 AT5G56340 AT5G56740 AT5G56790 AT5G57015 AT5G58350 AT5G58410 AT5G58450 AT5G59710 AT5G61480 AT5G63110 AT5G63610 AT5G63910 AT5G64920 AT5G65760 AT5G66060 AT5G66140 AT5G66850 AT5G66860 AT5G66880 AT5G67250 AT5G67320 AT5G67510 AT5G67530 AT5G67630 AT1G08680 AT1G22280 AT1G27910 AT1G49540 AT1G49780 AT1G59580 AT1G60220 AT1G71020 AT1G79810 AT2G15530 AT2G23740 AT2G25900 AT2G35930 AT2G39000 AT2G39660 AT2G39810 AT2G41980 AT2G43790 AT2G44950 AT3G01460 AT3G07360 AT3G08690 AT3G09970 AT3G14980 AT3G19980 AT3G21630 AT3G25070 AT3G45240 AT3G58040 AT4G12720 AT4G14220 AT4G19700 AT4G20400 AT4G24740 AT4G32660 AT4G33470 AT5G03455 AT5G07270 AT5G11860 AT5G14640 AT5G18650 AT5G19660 AT5G36250 AT5G42400 AT5G45360 AT5G45800 AT5G46410 AT5G50860 AT5G50870 AT5G55500 AT5G60160 AT5G60550 AT1G02100 AT1G02170 AT1G03365 AT1G03590 AT1G04910 AT1G05830 AT1G06110 AT1G07200 AT1G07210 AT1G07570 AT1G07910 AT1G08620 AT1G08660 AT1G08700 AT1G09160 AT1G09730 AT1G09840 AT1G10430 AT1G10650 AT1G10850 AT1G11480 AT1G12460 AT1G12760 AT1G12990 AT1G13270 AT1G13350 AT1G15810 AT1G16270 AT1G16710 AT1G16740 AT1G16900 AT1G17550 AT1G17860 AT1G18150 AT1G18160 AT1G18170 AT1G20780 AT1G20810 AT1G20823 AT1G21780 AT1G23780 AT1G25280 AT1G25390 AT1G27190 AT1G27520 AT1G28350 AT1G29965 AT1G30600 AT1G30810 AT1G31280 AT1G31810 AT1G35510 AT1G38131 AT1G43900 AT1G47200 AT1G47380 AT1G48120 AT1G49710 AT1G50240 AT1G50370 AT1G50380 AT1G51940 AT1G53780 AT1G55000 AT1G55250 AT1G56045 AT1G56180 AT1G57860 AT1G58684 AT1G59359 AT1G59830 AT1G61040 AT1G61580 AT1G61620 AT1G62330 AT1G62850 AT1G63170 AT1G63430 AT1G63490 AT1G63500 AT1G64040 AT1G64280 AT1G64880 AT1G65410 AT1G66070 AT1G66340 AT1G66680 AT1G66830 AT1G67340 AT1G67470 AT1G67890 AT1G68050 AT1G68400 AT1G68410 AT1G69410 AT1G69960 AT1G70980 AT1G71080 AT1G71410 AT1G71860 AT1G71990 AT1G72300 AT1G72320 AT1G72340 AT1G73100 AT1G73180 AT1G73460 AT1G73670 AT1G76360 AT1G76570 AT1G76920 AT1G77550 AT1G78100 AT1G78200 AT1G78660 AT1G78670 AT1G78680 AT1G78880 AT1G79110 AT1G79380 AT1G79730 AT1G80000 AT1G80620 AT2G01620 AT2G02220 AT2G02710 AT2G02800 AT2G02870 AT2G03510 AT2G04160 AT2G04740 AT2G07180 AT2G11000 AT2G14260 AT2G16920 AT2G16930 AT2G17220 AT2G17520 AT2G17530 AT2G17820 AT2G19170 AT2G19750 AT2G20000 AT2G20060 AT2G20370 AT2G20725 AT2G21270 AT2G22970 AT2G22980 AT2G23000 AT2G23140 AT2G23450 AT2G24990 AT2G25050 AT2G25070 AT2G25210 AT2G25800 AT2G26920 AT2G26980 AT2G27060 AT2G27210 AT2G28890 AT2G28930 AT2G29140 AT2G29200 AT2G29960 AT2G29970 AT2G30695 AT2G31060 AT2G33700 AT2G33840 AT2G34520 AT2G34970 AT2G36570 AT2G38560 AT2G38950 AT2G39760 AT2G39850 AT2G40270 AT2G40860 AT2G40880 AT2G40930 AT2G41160 AT2G42740 AT2G42780 AT2G42810 AT2G44140 AT2G45240 AT2G45270 AT2G45590 AT2G45730 AT2G45910 AT2G45950 AT2G46260 AT2G47700 AT3G01200 AT3G01490 AT3G01510 AT3G02660 AT3G02880 AT3G03600 AT3G03740 AT3G04580 AT3G04810 AT3G05500 AT3G05520 AT3G06040 AT3G06190 AT3G06330 AT3G06380 AT3G07180 AT3G07300 AT3G08020 AT3G08680 AT3G09770 AT3G09830 AT3G10360 AT3G10450 AT3G10610 AT3G10810 AT3G10940 AT3G11410 AT3G11540 AT3G12200 AT3G12400 AT3G12620 AT3G12920 AT3G12980 AT3G13235 AT3G13882 AT3G14720 AT3G15260 AT3G15580 AT3G16560 AT3G16810 AT3G17465 AT3G17750 AT3G18040 AT3G18520 AT3G19340 AT3G19910 AT3G20250 AT3G20260 AT3G20740 AT3G21870 AT3G22104 AT3G22300 AT3G22980 AT3G23150 AT3G23280 AT3G25220 AT3G26000 AT3G26085 AT3G26400 AT3G28690 AT3G28900 AT3G29350 AT3G30300 AT3G44200 AT3G44620 AT3G44750 AT3G46590 AT3G46820 AT3G48190 AT3G48380 AT3G48430 AT3G48530 AT3G49060 AT3G49080 AT3G51270 AT3G51740 AT3G51770 AT3G53380 AT3G54350 AT3G54480 AT3G54720 AT3G54790 AT3G55050 AT3G55170 AT3G55830 AT3G55960 AT3G57190 AT3G57490 AT3G57630 AT3G57830 AT3G58460 AT3G59540 AT3G59950 AT3G60370 AT3G61110 AT3G61140 AT3G61540 AT3G61740 AT3G62260 AT3G63120 AT3G63400 AT3G66654 AT4G00330 AT4G00660 AT4G02420 AT4G02440 AT4G04840 AT4G06599 AT4G08960 AT4G10570 AT4G10590 AT4G11110 AT4G11160 AT4G11175 AT4G11240 AT4G11680 AT4G12020 AT4G12560 AT4G13020 AT4G13460 AT4G14110 AT4G14365 AT4G16500 AT4G16580 AT4G16650 AT4G17070 AT4G17100 AT4G17486 AT4G18370 AT4G18950 AT4G20940 AT4G21460 AT4G21850 AT4G22290 AT4G22350 AT4G23860 AT4G24200 AT4G24810 AT4G25340 AT4G25890 AT4G26555 AT4G26720 AT4G27130 AT4G28360 AT4G28400 AT4G29210 AT4G29490 AT4G30350 AT4G30550 AT4G30910 AT4G30930 AT4G31170 AT4G31460 AT4G31820 AT4G31860 AT4G31985 AT4G32250 AT4G32915 AT4G33260 AT4G33920 AT4G35780 AT4G36420 AT4G38040 AT4G38470 AT4G39640 AT4G39710 AT5G01290 AT5G01820 AT5G01950 AT5G02880 AT5G03140 AT5G03320 AT5G04240 AT5G04540 AT5G04670 AT5G05470 AT5G05660 AT5G08160 AT5G08550 AT5G09230 AT5G09770 AT5G09850 AT5G10020 AT5G10630 AT5G11430 AT5G11850 AT5G13410 AT5G13520 AT5G13840 AT5G14420 AT5G16180 AT5G16590 AT5G16810 AT5G18110 AT5G18525 AT5G18700 AT5G19010 AT5G19280 AT5G19680 AT5G20000 AT5G20520 AT5G22030 AT5G22920 AT5G23535 AT5G24260 AT5G24360 AT5G24850 AT5G24870 AT5G27290 AT5G27840 AT5G35570 AT5G35680 AT5G35750 AT5G35840 AT5G37475 AT5G38510 AT5G40200 AT5G41260 AT5G42320 AT5G42940 AT5G43020 AT5G44530 AT5G45110 AT5G46570 AT5G47070 AT5G47320 AT5G48120 AT5G48380 AT5G48580 AT5G49660 AT5G50180 AT5G50320 AT5G50420 AT5G51560 AT5G53430 AT5G54760 AT5G55130 AT5G56280 AT5G56940 AT5G57130 AT5G57610 AT5G58160 AT5G58300 AT5G58380 AT5G59010 AT5G59160 AT5G59670 AT5G60750 AT5G61060 AT5G61840 AT5G62220 AT5G63160 AT5G63870 AT5G64610 AT5G64670 AT5G65470 AT5G65860 AT5G65920 AT5G66560 AT5G67280 AT5G67440 AT5G67480 ATCG00270 ATCG00680 ATCG00800 AT3G01150 AT5G53180 AT1G69770 AT1G02090 AT1G14350 AT1G18260 AT1G62830 AT2G26990 AT2G42700 AT3G10390 AT3G10480 AT3G10490 AT3G24140 AT3G24440 AT3G24870 AT3G24880 AT3G26380 AT3G47450 AT4G00830 AT4G22140 AT4G29830 AT4G34590 AT4G39100 AT5G01500 AT5G11530 AT5G20650 AT5G22010 AT5G42970 AT5G55390 AT5G58440 AT5G61770 AT5G63470 AT4G29960 AT2G28100 AT2G41110 AT5G04900"
