"Enrichment FDR","Genes in list","Total genes","Functional Category","Genes"
8.51288909318358e-11,724,3293,"Cellular component organization ","AT1G01370 AT1G04020 AT1G04200 AT1G05520 AT1G05780 AT1G05910 AT1G07130 AT1G07510 AT1G07980 AT1G08190 AT1G08220 AT1G08390 AT1G08620 AT1G09100 AT1G10180 AT1G10390 AT1G10690 AT1G12400 AT1G12470 AT1G13120 AT1G13210 AT1G14850 AT1G14910 AT1G15570 AT1G15660 AT1G15940 AT1G16970 AT1G17350 AT1G17500 AT1G18190 AT1G18600 AT1G19430 AT1G20610 AT1G21660 AT1G24190 AT1G24310 AT1G27700 AT1G28260 AT1G29400 AT1G29760 AT1G30450 AT1G30825 AT1G30960 AT1G31360 AT1G32990 AT1G44110 AT1G47230 AT1G48240 AT1G48635 AT1G49890 AT1G50900 AT1G51390 AT1G52370 AT1G53530 AT1G53780 AT1G54140 AT1G54210 AT1G54380 AT1G54385 AT1G55490 AT1G59890 AT1G60490 AT1G61990 AT1G62730 AT1G63990 AT1G64350 AT1G64740 AT1G65470 AT1G68710 AT1G69390 AT1G70060 AT1G71350 AT1G72420 AT1G72700 AT1G73240 AT1G73430 AT1G73790 AT1G75310 AT1G76310 AT1G76850 AT1G78240 AT1G79090 AT1G79560 AT1G79950 AT1G80245 AT1G80260 AT1G80350 AT2G02560 AT2G04940 AT2G05120 AT2G05170 AT2G05210 AT2G06510 AT2G14120 AT2G19560 AT2G19950 AT2G22640 AT2G22720 AT2G24060 AT2G24070 AT2G24490 AT2G25880 AT2G26570 AT2G26760 AT2G28870 AT2G29500 AT2G29580 AT2G31270 AT2G31970 AT2G32600 AT2G32850 AT2G32900 AT2G33560 AT2G34050 AT2G35110 AT2G35320 AT2G36250 AT2G36740 AT2G37840 AT2G39750 AT2G40550 AT2G41350 AT2G42890 AT2G44510 AT2G44580 AT2G45280 AT2G45700 AT2G46930 AT3G02920 AT3G02980 AT3G03000 AT3G03060 AT3G03340 AT3G03773 AT3G05710 AT3G06820 AT3G07740 AT3G08850 AT3G08980 AT3G09360 AT3G09410 AT3G09700 AT3G10110 AT3G10270 AT3G10650 AT3G11820 AT3G12270 AT3G12300 AT3G12810 AT3G13190 AT3G14120 AT3G15120 AT3G18524 AT3G18580 AT3G18790 AT3G19180 AT3G19190 AT3G19510 AT3G19590 AT3G20020 AT3G20740 AT3G20970 AT3G22270 AT3G22590 AT3G22930 AT3G23660 AT3G24350 AT3G26618 AT3G26680 AT3G27530 AT3G28700 AT3G29100 AT3G43230 AT3G43610 AT3G47690 AT3G48430 AT3G49180 AT3G49500 AT3G49590 AT3G50845 AT3G51890 AT3G52190 AT3G52400 AT3G57300 AT3G57350 AT3G60190 AT3G61650 AT3G61710 AT3G62060 AT3G62770 AT3G62880 AT3G63150 AT4G00020 AT4G00990 AT4G01310 AT4G02030 AT4G02070 AT4G02980 AT4G03430 AT4G05190 AT4G08540 AT4G11060 AT4G12130 AT4G12770 AT4G12780 AT4G14360 AT4G14990 AT4G15410 AT4G16420 AT4G19120 AT4G19540 AT4G20280 AT4G20400 AT4G23640 AT4G26470 AT4G26780 AT4G27060 AT4G27180 AT4G27650 AT4G29940 AT4G30510 AT4G30690 AT4G30790 AT4G32620 AT4G33650 AT4G33890 AT4G35620 AT4G36580 AT4G37210 AT4G37490 AT4G39160 AT4G39670 AT4G40080 AT5G02560 AT5G02820 AT5G03030 AT5G03830 AT5G03905 AT5G04240 AT5G04930 AT5G04990 AT5G05620 AT5G05710 AT5G06050 AT5G06200 AT5G07630 AT5G08020 AT5G08390 AT5G08565 AT5G09570 AT5G10400 AT5G10950 AT5G12390 AT5G14530 AT5G15600 AT5G15630 AT5G15680 AT5G16270 AT5G16280 AT5G16620 AT5G16800 AT5G16930 AT5G17410 AT5G17440 AT5G18410 AT5G19400 AT5G20200 AT5G21920 AT5G22840 AT5G23430 AT5G24630 AT5G26670 AT5G28740 AT5G35520 AT5G38720 AT5G43080 AT5G44240 AT5G45400 AT5G46910 AT5G47480 AT5G47880 AT5G48460 AT5G48520 AT5G48720 AT5G49880 AT5G50230 AT5G51200 AT5G51340 AT5G51410 AT5G54670 AT5G54920 AT5G55100 AT5G55200 AT5G56090 AT5G56290 AT5G57950 AT5G58784 AT5G61000 AT5G61960 AT5G62500 AT5G63110 AT5G63220 AT5G66930 AT5G67270 ATCG00810 AT1G01780 AT1G08490 AT1G32500 AT1G48320 AT1G49540 AT1G77300 AT2G16485 AT2G16700 AT2G17870 AT2G20190 AT2G22370 AT2G23080 AT2G27350 AT2G45490 AT3G01460 AT3G14980 AT3G17880 AT3G20840 AT3G25980 AT3G52280 AT4G00680 AT4G05520 AT4G13510 AT4G15920 AT4G28730 AT4G34660 AT5G09260 AT5G18190 AT5G24330 AT5G42400 AT5G51600 AT5G60300 AT1G02720 AT1G03780 AT1G04400 AT1G05650 AT1G05660 AT1G05830 AT1G06780 AT1G08460 AT1G08600 AT1G12040 AT1G12560 AT1G14020 AT1G14080 AT1G15220 AT1G16340 AT1G16710 AT1G16800 AT1G17520 AT1G18580 AT1G19170 AT1G19300 AT1G21610 AT1G21700 AT1G23480 AT1G24170 AT1G24450 AT1G27440 AT1G27600 AT1G29060 AT1G30620 AT1G32750 AT1G32860 AT1G48930 AT1G50410 AT1G53830 AT1G54150 AT1G56460 AT1G57820 AT1G61040 AT1G62440 AT1G62850 AT1G63270 AT1G64220 AT1G64390 AT1G64440 AT1G69530 AT1G70090 AT1G71990 AT1G72740 AT1G73100 AT1G73960 AT1G77130 AT1G79000 AT1G79450 AT1G79730 AT1G79810 AT1G80190 AT2G01850 AT2G02090 AT2G03220 AT2G13370 AT2G14285 AT2G15880 AT2G16440 AT2G17900 AT2G17930 AT2G23380 AT2G24240 AT2G26460 AT2G26770 AT2G26780 AT2G27500 AT2G28950 AT2G31900 AT2G33400 AT2G33610 AT2G33847 AT2G34150 AT2G35650 AT2G36850 AT2G37090 AT2G37620 AT2G38440 AT2G38650 AT2G39700 AT2G44950 AT2G45220 AT2G46290 AT2G47620 AT3G01040 AT3G02170 AT3G03220 AT3G06010 AT3G06770 AT3G09030 AT3G09090 AT3G10330 AT3G10380 AT3G10720 AT3G12980 AT3G15180 AT3G19720 AT3G20010 AT3G21190 AT3G21400 AT3G21820 AT3G22800 AT3G22990 AT3G24010 AT3G24880 AT3G27070 AT3G28180 AT3G29090 AT3G33520 AT3G42950 AT3G43220 AT3G43270 AT3G47460 AT3G48150 AT3G48360 AT3G49220 AT3G49560 AT3G49850 AT3G54350 AT3G59100 AT3G60830 AT3G61490 AT3G62110 AT3G63430 AT4G02020 AT4G03550 AT4G04970 AT4G14147 AT4G14600 AT4G16120 AT4G16444 AT4G17220 AT4G18600 AT4G19020 AT4G20170 AT4G20460 AT4G22285 AT4G22350 AT4G23820 AT4G25810 AT4G25820 AT4G28710 AT4G29360 AT4G30270 AT4G30290 AT4G30860 AT4G31210 AT4G33200 AT4G34430 AT4G36080 AT4G37610 AT4G38210 AT4G38270 AT4G39350 AT5G03760 AT5G04320 AT5G04670 AT5G04940 AT5G06000 AT5G06640 AT5G08380 AT5G10710 AT5G13870 AT5G14550 AT5G15470 AT5G15920 AT5G16190 AT5G16910 AT5G17550 AT5G18920 AT5G20610 AT5G20840 AT5G22940 AT5G24450 AT5G25830 AT5G39550 AT5G40530 AT5G40930 AT5G43130 AT5G44030 AT5G44040 AT5G44480 AT5G44635 AT5G46150 AT5G47820 AT5G48600 AT5G49160 AT5G51230 AT5G53280 AT5G54690 AT5G55000 AT5G55480 AT5G55510 AT5G56590 AT5G58480 AT5G61060 AT5G61140 AT5G62410 AT5G63135 AT5G63140 AT5G63160 AT5G64610 AT5G66750 AT5G67480 AT5G67580 ATMG00180 AT1G20910 AT1G48550 AT1G71830 AT1G76510 AT1G77220 AT2G02970 AT2G17410 AT3G05580 AT3G13360 AT3G14270 AT3G46290 AT3G50960 AT3G63270 AT4G00630 AT4G15415 AT4G19180 AT4G33240 AT4G38360 AT5G03220 AT5G03470 AT5G10490 AT5G19390 AT5G54380 AT5G56210 AT5G64070 AT1G03060 AT1G04300 AT1G04770 AT1G05180 AT1G09020 AT1G13980 AT1G14350 AT1G15130 AT1G15215 AT1G22950 AT1G25580 AT1G31420 AT1G35670 AT1G44000 AT1G48380 AT1G49510 AT1G50030 AT1G53510 AT1G54440 AT1G54490 AT1G55350 AT1G56580 AT1G58250 AT1G60420 AT1G65260 AT1G66340 AT1G67360 AT1G69220 AT1G71230 AT1G72300 AT1G79850 AT2G01110 AT2G01690 AT2G02480 AT2G04550 AT2G20370 AT2G20610 AT2G21385 AT2G21410 AT2G22330 AT2G27460 AT2G28620 AT2G33460 AT2G33800 AT2G35620 AT2G35940 AT2G41970 AT2G42080 AT2G43410 AT2G46340 AT2G46710 AT2G47940 AT3G02242 AT3G03810 AT3G04340 AT3G05210 AT3G05330 AT3G10480 AT3G10490 AT3G10670 AT3G12400 AT3G12977 AT3G14190 AT3G15095 AT3G15380 AT3G15950 AT3G16270 AT3G18420 AT3G19220 AT3G19770 AT3G20540 AT3G23980 AT3G24440 AT3G26900 AT3G45100 AT3G46740 AT3G48820 AT3G50660 AT3G51050 AT3G52250 AT3G54010 AT3G54180 AT3G55005 AT3G58040 AT3G60370 AT3G62800 AT4G00730 AT4G02350 AT4G05440 AT4G08920 AT4G09730 AT4G10620 AT4G10790 AT4G17410 AT4G19600 AT4G20780 AT4G22260 AT4G26430 AT4G28370 AT4G31010 AT4G31560 AT4G35760 AT4G36630 AT5G03280 AT5G04290 AT5G04920 AT5G09420 AT5G11530 AT5G12130 AT5G13610 AT5G16490 AT5G18700 AT5G19540 AT5G20350 AT5G20820 AT5G22010 AT5G22350 AT5G22640 AT5G24020 AT5G24314 AT5G26742 AT5G39500 AT5G44070 AT5G45190 AT5G48030 AT5G53860 AT5G54440 AT5G56580 AT5G58100 AT5G58270 AT5G61900 AT5G64340 AT5G64930 AT5G65530 AT2G03500 AT4G14570 AT5G55630 AT1G62740 AT2G20650 AT2G46180 AT4G12400 AT4G29530 AT5G02200 AT5G45330 AT1G05560 AT3G54860 AT4G04340 AT4G34980 AT5G07880 AT5G13820 AT5G46280"
6.23433653253403e-09,129,424,"Cell division ","AT1G49040 AT2G25880 AT2G31270 AT4G00020 AT4G02980 AT4G39350 AT5G16910 AT5G24020 AT5G44030 AT1G57820 AT4G34660 AT1G03780 AT1G15570 AT1G15660 AT1G18040 AT1G18370 AT1G20610 AT1G27630 AT1G44110 AT1G47230 AT1G53050 AT1G53140 AT1G53710 AT1G66750 AT1G69390 AT1G73177 AT1G76310 AT1G78770 AT2G14120 AT2G18290 AT2G20000 AT2G20190 AT2G26430 AT2G26760 AT2G32900 AT2G39090 AT2G40550 AT2G41350 AT2G45490 AT2G47990 AT3G01610 AT3G05870 AT3G14190 AT3G19590 AT3G22270 AT3G25980 AT3G47460 AT3G47690 AT3G48150 AT3G48210 AT3G49860 AT3G54180 AT3G60190 AT3G60550 AT4G05190 AT4G05440 AT4G14310 AT4G19600 AT4G28980 AT4G33650 AT4G35620 AT4G37490 AT5G01230 AT5G16270 AT5G18700 AT5G23700 AT5G27620 AT5G35520 AT5G43080 AT5G45190 AT5G48520 AT5G48600 AT5G48630 AT5G48640 AT5G49880 AT5G51340 AT5G51600 AT5G62410 AT5G62500 AT5G63610 AT5G67270 AT1G74930 AT4G17500 AT4G34410 AT2G28350 AT3G17360 AT3G19050 AT3G45590 AT3G50960 AT4G24560 AT4G35460 AT5G19390 AT1G01040 AT1G01370 AT1G03840 AT1G08260 AT1G10270 AT1G13980 AT1G14350 AT1G14920 AT1G17110 AT1G51170 AT1G54490 AT1G65470 AT1G66340 AT1G69380 AT2G01210 AT2G28620 AT2G44950 AT3G05330 AT3G12400 AT3G15770 AT3G19770 AT3G20550 AT3G23980 AT3G33520 AT3G51770 AT3G55005 AT3G61650 AT4G21800 AT4G30290 AT5G03280 AT5G03730 AT5G05620 AT5G44160 AT5G49160 AT5G54440 AT5G56580 AT1G05560"
1.05249052105173e-08,297,1204,"Negative regulation of biological process ","AT1G01040 AT1G02120 AT1G04020 AT1G05910 AT1G06450 AT1G07130 AT1G07705 AT1G07980 AT1G08390 AT1G09700 AT1G10170 AT1G10690 AT1G14920 AT1G24190 AT1G24450 AT1G28260 AT1G32360 AT1G43850 AT1G47710 AT1G50030 AT1G59890 AT1G70060 AT1G79090 AT1G79950 AT2G04550 AT2G05210 AT2G15270 AT2G19560 AT2G24490 AT2G25355 AT2G28870 AT2G31270 AT2G31305 AT2G32900 AT2G33560 AT2G35320 AT2G37680 AT2G39260 AT3G02920 AT3G07750 AT3G11410 AT3G12640 AT3G12680 AT3G12810 AT3G12930 AT3G12990 AT3G15120 AT3G18524 AT3G19360 AT3G19590 AT3G20550 AT3G20740 AT3G22270 AT3G44260 AT3G46960 AT3G47290 AT3G48160 AT3G49500 AT4G00020 AT4G02070 AT4G03430 AT4G14990 AT4G25520 AT4G27650 AT4G32175 AT4G36390 AT5G12980 AT5G13240 AT5G13570 AT5G14070 AT5G14580 AT5G20910 AT5G24020 AT5G24330 AT5G35430 AT5G49880 AT5G58700 AT5G59180 AT5G59710 AT5G64610 AT1G04550 AT1G13460 AT1G31500 AT1G78310 AT2G16485 AT2G17975 AT2G30395 AT2G30400 AT2G32710 AT2G34140 AT2G34720 AT2G39740 AT2G43140 AT2G45620 AT3G10480 AT3G10490 AT3G12620 AT3G15880 AT3G19580 AT3G24810 AT3G25980 AT3G48050 AT3G50870 AT3G52250 AT3G53970 AT4G06634 AT4G12770 AT4G12780 AT4G20400 AT4G35580 AT4G37180 AT4G39070 AT5G02810 AT5G06270 AT5G11530 AT5G57620 AT5G63320 AT5G66210 AT1G08620 AT1G15910 AT1G22730 AT1G26660 AT1G32310 AT1G50410 AT1G54440 AT1G55150 AT1G71800 AT1G80000 AT2G02090 AT2G23380 AT2G26460 AT2G37380 AT2G38025 AT2G40330 AT3G03570 AT3G04580 AT3G05040 AT3G20010 AT3G26090 AT3G29160 AT3G55070 AT3G62800 AT3G63530 AT4G02020 AT4G19190 AT4G21670 AT4G24500 AT4G40050 AT5G04290 AT5G05110 AT5G09860 AT5G11030 AT5G19400 AT5G23080 AT5G23570 AT5G26230 AT5G46790 AT5G56130 AT5G61900 AT5G61910 AT5G63120 AT5G63135 AT2G27350 AT2G35270 AT2G39810 AT3G10930 AT4G35390 AT1G20910 AT1G60650 AT1G71230 AT1G76510 AT1G77220 AT1G80440 AT2G17410 AT2G25760 AT2G26070 AT2G31880 AT2G41560 AT3G01650 AT3G03773 AT3G17000 AT3G57330 AT3G63270 AT4G16430 AT4G32620 AT4G38360 AT5G04280 AT5G06950 AT5G14420 AT5G18190 AT5G22090 AT1G08030 AT1G08260 AT1G13960 AT1G15215 AT1G17980 AT1G21610 AT1G22950 AT1G24625 AT1G25580 AT1G27320 AT1G28420 AT1G48270 AT1G49040 AT1G49540 AT1G51170 AT1G51940 AT1G54490 AT1G57820 AT1G58250 AT1G61040 AT1G62300 AT1G64280 AT1G76260 AT1G77300 AT1G79730 AT1G80840 AT2G03500 AT2G13790 AT2G18290 AT2G19430 AT2G20190 AT2G21150 AT2G22370 AT2G22430 AT2G34780 AT2G39940 AT2G40830 AT2G42620 AT2G43410 AT2G46340 AT3G06670 AT3G07650 AT3G08850 AT3G11820 AT3G14980 AT3G15150 AT3G15850 AT3G20250 AT3G22400 AT3G23780 AT3G24440 AT3G26000 AT3G28450 AT3G33520 AT3G48430 AT3G49180 AT3G52150 AT3G55560 AT3G57390 AT4G00238 AT4G08920 AT4G14465 AT4G15415 AT4G17410 AT4G19040 AT4G24960 AT4G28190 AT4G29140 AT4G34590 AT4G35600 AT4G37460 AT4G37740 AT4G38620 AT5G01810 AT5G03280 AT5G04240 AT5G08330 AT5G13680 AT5G16000 AT5G16260 AT5G20170 AT5G22010 AT5G22290 AT5G23880 AT5G25160 AT5G35750 AT5G39550 AT5G40280 AT5G44180 AT5G48380 AT5G49160 AT5G51230 AT5G57740 AT5G60800 AT5G62000 AT5G62570 AT5G63110 AT5G64390 AT5G66750 AT5G02200 AT5G40530 AT5G45330 AT2G22090 AT1G22640 AT1G66340 AT5G03730"
1.52284698239141e-08,143,491,"Peptidyl-amino acid modification ","AT1G04020 AT1G04210 AT1G12680 AT1G24610 AT1G35670 AT1G49580 AT1G54140 AT1G69420 AT1G76040 AT2G19470 AT2G21470 AT2G25760 AT2G30880 AT2G41140 AT3G02980 AT3G04480 AT3G04970 AT3G07740 AT3G10540 AT3G12270 AT3G19510 AT3G20020 AT3G23310 AT3G28480 AT3G48760 AT3G50530 AT3G51390 AT3G51850 AT3G54010 AT3G56570 AT3G60800 AT4G00020 AT4G00840 AT4G01730 AT4G04700 AT4G04720 AT4G09570 AT4G14350 AT4G15080 AT4G15880 AT4G16420 AT4G24630 AT4G26100 AT4G29940 AT4G33060 AT4G33890 AT4G38230 AT5G04270 AT5G04510 AT5G05920 AT5G08415 AT5G14530 AT5G16800 AT5G18190 AT5G44100 AT5G55170 AT5G57015 AT5G58450 AT5G62030 AT5G66060 AT5G66210 AT5G67530 AT1G49540 AT1G60220 AT1G77300 AT2G45490 AT3G01460 AT3G06440 AT3G14980 AT3G15150 AT4G25720 AT5G15120 AT5G24330 AT5G39890 AT5G42400 AT5G53340 AT1G04900 AT1G05830 AT1G07570 AT1G16710 AT1G26940 AT1G27320 AT1G32750 AT1G52310 AT1G53720 AT1G53780 AT1G66340 AT1G71830 AT1G73100 AT1G73655 AT1G79000 AT2G01830 AT2G02780 AT2G13790 AT2G15790 AT2G17900 AT2G17930 AT2G23380 AT2G25880 AT2G31880 AT2G38730 AT2G41970 AT3G12980 AT3G20740 AT3G21640 AT3G21820 AT3G28700 AT3G48360 AT3G52280 AT3G54350 AT3G55920 AT3G60370 AT4G02020 AT4G17070 AT4G30520 AT4G30860 AT4G36080 AT4G37610 AT4G39270 AT5G04670 AT5G04940 AT5G08280 AT5G35100 AT5G35750 AT5G41180 AT5G63140 AT5G63160 AT5G64610 AT5G67480 AT1G09730 AT1G14350 AT1G54440 AT2G22370 AT3G22590 AT3G24440 AT3G24880 AT3G48430 AT3G52250 AT4G17410 AT5G11530 AT5G22010 AT5G66750 AT2G03500"
2.21948514864713e-08,141,485,"Cell cycle process ","AT1G04020 AT1G08390 AT1G10690 AT1G15570 AT1G15660 AT1G15940 AT1G20610 AT1G29400 AT1G44110 AT1G47230 AT1G49040 AT1G49890 AT1G63990 AT1G64350 AT1G73790 AT1G76310 AT1G80190 AT1G80245 AT1G80260 AT2G24070 AT2G24490 AT2G25880 AT2G26760 AT2G28870 AT2G31270 AT2G31970 AT2G32900 AT2G33560 AT2G40550 AT2G41350 AT2G42890 AT2G44510 AT2G44580 AT2G45280 AT3G02920 AT3G03000 AT3G05210 AT3G18524 AT3G19590 AT3G22930 AT3G43610 AT3G47690 AT3G49180 AT3G61650 AT4G00020 AT4G02070 AT4G02980 AT4G05190 AT4G26470 AT4G27180 AT4G32620 AT4G35620 AT4G37490 AT4G39350 AT5G02820 AT5G03830 AT5G05620 AT5G10950 AT5G16270 AT5G16910 AT5G17410 AT5G24630 AT5G35520 AT5G43080 AT5G44030 AT5G48520 AT5G48720 AT5G49880 AT5G51340 AT5G54670 AT5G61960 AT5G62500 AT5G67100 AT5G67270 AT3G25980 AT4G34660 AT1G03780 AT1G48380 AT1G69390 AT2G06510 AT2G26460 AT2G32710 AT2G33400 AT2G45490 AT3G24810 AT3G48150 AT5G04320 AT5G15920 AT5G23700 AT5G44040 AT5G58020 AT5G63135 AT1G18370 AT1G71830 AT3G17360 AT3G19050 AT3G45590 AT3G48160 AT3G50960 AT4G36860 AT5G03470 AT5G19390 AT1G01040 AT1G01370 AT1G05180 AT1G13980 AT1G14350 AT1G14920 AT1G15110 AT1G20930 AT1G25580 AT1G32310 AT1G53140 AT1G55350 AT1G69380 AT1G71230 AT1G78770 AT2G01210 AT2G18290 AT2G28620 AT2G34780 AT2G36850 AT2G38620 AT2G44950 AT3G05330 AT3G14190 AT3G15150 AT3G19770 AT3G54180 AT3G55005 AT5G03415 AT5G04990 AT5G18700 AT5G19400 AT5G22010 AT5G48600 AT5G49160 AT5G51600 AT5G54440 AT5G56580 AT1G05560"
4.47225647731555e-08,223,866,"Establishment of protein localization ","AT1G04830 AT1G05810 AT1G07410 AT1G10390 AT1G13120 AT1G14850 AT1G22740 AT1G24310 AT1G26170 AT1G27700 AT1G30900 AT1G48090 AT1G48240 AT1G48550 AT1G48635 AT1G53530 AT1G63810 AT1G69420 AT1G72560 AT1G75850 AT2G01110 AT2G05120 AT2G14740 AT2G17790 AT2G19560 AT2G20840 AT2G21880 AT2G30710 AT2G31680 AT2G36680 AT2G37680 AT2G43130 AT2G44510 AT3G02460 AT3G03120 AT3G04490 AT3G04970 AT3G05040 AT3G05710 AT3G07410 AT3G07890 AT3G08947 AT3G08960 AT3G08980 AT3G09700 AT3G10110 AT3G10380 AT3G10650 AT3G11820 AT3G14120 AT3G16090 AT3G17340 AT3G21700 AT3G24350 AT3G27530 AT3G29100 AT3G47120 AT3G48760 AT3G49350 AT3G49560 AT3G51310 AT3G51390 AT3G52190 AT3G52400 AT3G53120 AT3G54380 AT3G55020 AT3G57350 AT3G60800 AT3G61480 AT3G62880 AT4G00840 AT4G01730 AT4G05000 AT4G08320 AT4G13730 AT4G15080 AT4G17140 AT4G18430 AT4G18800 AT4G19003 AT4G20110 AT4G20410 AT4G24630 AT4G26780 AT4G27040 AT4G27690 AT4G29950 AT4G38760 AT4G39990 AT5G01590 AT5G03030 AT5G03830 AT5G04270 AT5G04920 AT5G05680 AT5G09860 AT5G15930 AT5G16620 AT5G17060 AT5G41940 AT5G42920 AT5G47480 AT5G47520 AT5G54840 AT5G55200 AT5G55510 AT5G56130 AT5G56290 AT5G62600 AT5G63220 AT5G65270 AT5G66055 AT1G50900 AT3G04340 AT3G46740 AT5G22640 AT5G52440 AT5G55500 AT1G03380 AT1G05520 AT1G06210 AT1G08190 AT1G12470 AT1G13980 AT1G15130 AT1G23900 AT1G25420 AT1G29060 AT1G33410 AT1G34220 AT1G50730 AT1G51740 AT1G54090 AT1G54210 AT1G54710 AT1G56590 AT1G64220 AT1G64350 AT1G72470 AT1G73430 AT1G76850 AT1G77140 AT1G79070 AT2G05170 AT2G15290 AT2G20790 AT2G27460 AT2G32900 AT2G34840 AT2G36360 AT2G37840 AT2G38025 AT2G44140 AT3G01610 AT3G06540 AT3G09800 AT3G12400 AT3G15380 AT3G15920 AT3G16270 AT3G17970 AT3G19190 AT3G23660 AT3G23710 AT3G27070 AT3G44340 AT3G49590 AT3G50860 AT3G51890 AT3G55150 AT3G59950 AT3G60640 AT3G62770 AT4G00800 AT4G02030 AT4G03320 AT4G14600 AT4G16444 AT4G19490 AT4G23430 AT4G23460 AT4G26750 AT4G27840 AT4G30510 AT4G30790 AT4G30840 AT4G32160 AT4G32640 AT4G33350 AT4G36630 AT4G37130 AT4G38200 AT4G39170 AT5G04850 AT5G07880 AT5G09260 AT5G09420 AT5G17550 AT5G21990 AT5G22770 AT5G23550 AT5G28750 AT5G39500 AT5G40480 AT5G40930 AT5G49910 AT5G50230 AT5G50380 AT5G51200 AT5G52990 AT5G55710 AT5G56020 AT5G58430 AT5G58440 AT5G63880 AT5G66930 AT2G24020 AT3G61710 AT1G79560 AT1G79810 AT3G09030 AT4G21160"
4.95876283003587e-08,221,858,"Protein transport ","AT1G04830 AT1G05810 AT1G07410 AT1G10390 AT1G13120 AT1G14850 AT1G22740 AT1G24310 AT1G26170 AT1G27700 AT1G30900 AT1G48090 AT1G48240 AT1G48550 AT1G48635 AT1G53530 AT1G63810 AT1G69420 AT1G72560 AT1G75850 AT2G01110 AT2G05120 AT2G14740 AT2G17790 AT2G19560 AT2G20840 AT2G21880 AT2G30710 AT2G31680 AT2G36680 AT2G37680 AT2G43130 AT2G44510 AT3G02460 AT3G03120 AT3G04490 AT3G04970 AT3G05040 AT3G05710 AT3G07410 AT3G07890 AT3G08947 AT3G08960 AT3G08980 AT3G09700 AT3G10110 AT3G10380 AT3G10650 AT3G11820 AT3G14120 AT3G16090 AT3G17340 AT3G21700 AT3G24350 AT3G27530 AT3G29100 AT3G47120 AT3G48760 AT3G49350 AT3G49560 AT3G51310 AT3G51390 AT3G52190 AT3G52400 AT3G53120 AT3G54380 AT3G55020 AT3G57350 AT3G60800 AT3G61480 AT3G62880 AT4G00840 AT4G01730 AT4G05000 AT4G08320 AT4G13730 AT4G15080 AT4G17140 AT4G18430 AT4G18800 AT4G19003 AT4G20110 AT4G20410 AT4G24630 AT4G26780 AT4G27040 AT4G27690 AT4G29950 AT4G38760 AT4G39990 AT5G01590 AT5G03030 AT5G03830 AT5G04270 AT5G04920 AT5G05680 AT5G09860 AT5G15930 AT5G16620 AT5G17060 AT5G41940 AT5G42920 AT5G47480 AT5G47520 AT5G54840 AT5G55200 AT5G55510 AT5G56130 AT5G56290 AT5G62600 AT5G65270 AT5G66055 AT1G50900 AT3G04340 AT3G46740 AT5G22640 AT5G52440 AT5G55500 AT1G03380 AT1G05520 AT1G06210 AT1G08190 AT1G12470 AT1G13980 AT1G15130 AT1G23900 AT1G25420 AT1G29060 AT1G33410 AT1G34220 AT1G50730 AT1G51740 AT1G54090 AT1G54210 AT1G54710 AT1G56590 AT1G64220 AT1G64350 AT1G72470 AT1G73430 AT1G76850 AT1G77140 AT1G79070 AT2G05170 AT2G15290 AT2G20790 AT2G27460 AT2G32900 AT2G34840 AT2G36360 AT2G37840 AT2G38025 AT2G44140 AT3G01610 AT3G06540 AT3G09800 AT3G12400 AT3G15380 AT3G15920 AT3G16270 AT3G17970 AT3G19190 AT3G23660 AT3G23710 AT3G27070 AT3G44340 AT3G49590 AT3G50860 AT3G51890 AT3G55150 AT3G59950 AT3G60640 AT3G62770 AT4G00800 AT4G02030 AT4G03320 AT4G14600 AT4G19490 AT4G23430 AT4G23460 AT4G26750 AT4G27840 AT4G30510 AT4G30790 AT4G30840 AT4G32160 AT4G32640 AT4G33350 AT4G36630 AT4G37130 AT4G38200 AT4G39170 AT5G04850 AT5G07880 AT5G09260 AT5G09420 AT5G17550 AT5G21990 AT5G22770 AT5G23550 AT5G28750 AT5G39500 AT5G40480 AT5G40930 AT5G49910 AT5G50230 AT5G50380 AT5G51200 AT5G52990 AT5G55710 AT5G56020 AT5G58430 AT5G58440 AT5G63880 AT5G66930 AT2G24020 AT3G61710 AT1G79560 AT1G79810 AT3G09030 AT4G21160"
6.83669304211821e-08,230,904,"Protein modification by small protein conjugation or removal ","AT1G04860 AT1G05180 AT1G05350 AT1G14200 AT1G17110 AT1G26800 AT1G28120 AT1G55530 AT1G55860 AT1G57820 AT1G65430 AT1G71230 AT1G72310 AT1G76260 AT2G02560 AT2G18290 AT2G21470 AT2G22310 AT2G24640 AT2G27350 AT2G31510 AT2G38025 AT2G39720 AT2G40830 AT3G03550 AT3G06820 AT3G13430 AT3G16090 AT3G17205 AT3G28970 AT3G45630 AT3G46460 AT3G48070 AT4G15880 AT4G24560 AT4G26400 AT4G33565 AT4G34370 AT5G02310 AT5G02750 AT5G03330 AT5G06460 AT5G15400 AT5G17600 AT5G39550 AT5G40250 AT5G55170 AT5G56340 AT5G59550 AT5G60170 AT5G67170 AT5G67530 AT1G29340 AT1G60220 AT1G71020 AT1G78420 AT1G79810 AT2G01150 AT2G35930 AT2G39810 AT2G44950 AT3G01650 AT3G05200 AT3G15150 AT3G19380 AT3G47990 AT3G52450 AT3G55530 AT3G58040 AT3G63530 AT4G14220 AT4G17410 AT5G07270 AT5G20910 AT5G57740 AT5G64920 AT1G01640 AT1G03365 AT1G04020 AT1G04790 AT1G08710 AT1G10170 AT1G12820 AT1G20823 AT1G21760 AT1G22510 AT1G23780 AT1G26830 AT1G30900 AT1G53190 AT1G54150 AT1G55000 AT1G55760 AT1G56610 AT1G63090 AT1G63170 AT1G63850 AT1G64280 AT1G67340 AT1G72175 AT1G73177 AT1G74770 AT1G75440 AT1G78770 AT2G01735 AT2G02230 AT2G02360 AT2G04740 AT2G05330 AT2G14740 AT2G14820 AT2G15530 AT2G16740 AT2G16920 AT2G17020 AT2G19430 AT2G20000 AT2G20650 AT2G21950 AT2G24240 AT2G30600 AT2G32950 AT2G33770 AT2G35910 AT2G39090 AT2G39760 AT2G39940 AT2G40640 AT2G40930 AT2G42030 AT2G42620 AT2G44270 AT2G45910 AT2G45950 AT2G46260 AT3G02290 AT3G03740 AT3G05870 AT3G06330 AT3G09030 AT3G09770 AT3G10810 AT3G10910 AT3G13550 AT3G15070 AT3G16740 AT3G17000 AT3G18773 AT3G21280 AT3G22104 AT3G24800 AT3G26000 AT3G29270 AT3G47890 AT3G47910 AT3G48150 AT3G48360 AT3G50780 AT3G51770 AT3G55070 AT3G56230 AT3G58530 AT3G60080 AT3G61415 AT3G62970 AT4G00335 AT4G02680 AT4G02740 AT4G09100 AT4G11680 AT4G15475 AT4G19660 AT4G20110 AT4G21100 AT4G21510 AT4G22285 AT4G22350 AT4G23860 AT4G24015 AT4G26430 AT4G27050 AT4G28370 AT4G30370 AT4G31160 AT4G31450 AT4G31820 AT4G33210 AT4G33940 AT4G34040 AT4G34100 AT4G35910 AT4G37610 AT4G37880 AT5G01520 AT5G01720 AT5G01980 AT5G05660 AT5G07040 AT5G10650 AT5G10790 AT5G11030 AT5G14420 AT5G19000 AT5G19080 AT5G22030 AT5G22920 AT5G27920 AT5G37930 AT5G41340 AT5G41350 AT5G42940 AT5G43190 AT5G45100 AT5G45110 AT5G47050 AT5G49980 AT5G53360 AT5G55000 AT5G57035 AT5G57360 AT5G58410 AT5G62560 AT5G63160 AT5G64660 AT5G65740 AT5G65920 AT5G66560 AT5G67440 AT5G67480 AT1G09730"
7.16980379625266e-08,289,1189,"Nitrogen compound transport ","AT1G04830 AT1G05810 AT1G07410 AT1G08230 AT1G10390 AT1G13120 AT1G14360 AT1G14850 AT1G22740 AT1G24310 AT1G25380 AT1G26170 AT1G27700 AT1G30900 AT1G44100 AT1G48090 AT1G48240 AT1G48550 AT1G48635 AT1G53530 AT1G58360 AT1G63810 AT1G69420 AT1G72560 AT1G75850 AT1G77380 AT2G01110 AT2G01170 AT2G02810 AT2G05120 AT2G14740 AT2G17790 AT2G19560 AT2G20840 AT2G21880 AT2G30710 AT2G31680 AT2G35612 AT2G36680 AT2G37680 AT2G39130 AT2G39890 AT2G43130 AT2G44510 AT2G47490 AT3G02460 AT3G03120 AT3G04490 AT3G04970 AT3G05040 AT3G05710 AT3G07410 AT3G07890 AT3G08947 AT3G08960 AT3G08980 AT3G09700 AT3G10110 AT3G10380 AT3G10650 AT3G11820 AT3G14120 AT3G16090 AT3G17340 AT3G21390 AT3G21700 AT3G24300 AT3G24350 AT3G27530 AT3G27700 AT3G29100 AT3G47120 AT3G48760 AT3G49350 AT3G49560 AT3G51310 AT3G51390 AT3G52190 AT3G52400 AT3G53120 AT3G54380 AT3G55020 AT3G57350 AT3G60800 AT3G61480 AT3G62880 AT4G00840 AT4G01730 AT4G05000 AT4G08320 AT4G13510 AT4G13730 AT4G15080 AT4G17140 AT4G18430 AT4G18800 AT4G19003 AT4G20110 AT4G20410 AT4G24630 AT4G26780 AT4G27040 AT4G27690 AT4G29950 AT4G38760 AT4G39670 AT4G39990 AT5G01590 AT5G03030 AT5G03830 AT5G04270 AT5G04920 AT5G05680 AT5G09860 AT5G15930 AT5G16620 AT5G17060 AT5G41940 AT5G42920 AT5G46800 AT5G47480 AT5G47520 AT5G48970 AT5G54840 AT5G55200 AT5G55510 AT5G56130 AT5G56290 AT5G62600 AT5G65270 AT5G66055 AT1G31830 AT1G50900 AT2G13650 AT2G26510 AT2G27810 AT2G28315 AT2G30460 AT2G32040 AT3G04340 AT3G15380 AT3G16180 AT3G46740 AT4G31600 AT5G07320 AT5G12170 AT5G13490 AT5G17400 AT5G19380 AT5G22640 AT5G52440 AT5G55500 AT5G58970 AT5G62680 AT1G03380 AT1G05520 AT1G06210 AT1G08190 AT1G12110 AT1G12470 AT1G12500 AT1G13980 AT1G15130 AT1G17120 AT1G23900 AT1G25420 AT1G29060 AT1G30840 AT1G33410 AT1G34220 AT1G44750 AT1G50730 AT1G51740 AT1G54090 AT1G54210 AT1G54710 AT1G56590 AT1G57990 AT1G64220 AT1G64350 AT1G67940 AT1G72470 AT1G73430 AT1G76850 AT1G77140 AT1G79070 AT1G79450 AT1G80000 AT1G80760 AT2G05170 AT2G15290 AT2G19430 AT2G20790 AT2G26690 AT2G27460 AT2G32900 AT2G34840 AT2G36360 AT2G37840 AT2G38025 AT2G43240 AT2G44140 AT3G01610 AT3G03720 AT3G06540 AT3G09800 AT3G12400 AT3G15920 AT3G16270 AT3G17970 AT3G19190 AT3G23660 AT3G23710 AT3G27070 AT3G44340 AT3G46180 AT3G49590 AT3G50860 AT3G51890 AT3G55150 AT3G59360 AT3G59950 AT3G60640 AT3G62770 AT4G00800 AT4G01430 AT4G02030 AT4G03320 AT4G05120 AT4G14600 AT4G19490 AT4G21680 AT4G23430 AT4G23460 AT4G24880 AT4G26750 AT4G27840 AT4G30510 AT4G30790 AT4G30840 AT4G31730 AT4G32160 AT4G32640 AT4G33350 AT4G36630 AT4G37130 AT4G38200 AT4G39170 AT5G04850 AT5G05820 AT5G07880 AT5G09260 AT5G09420 AT5G17550 AT5G21990 AT5G22770 AT5G23550 AT5G28750 AT5G36940 AT5G37720 AT5G39500 AT5G40480 AT5G40930 AT5G46050 AT5G46150 AT5G49910 AT5G50200 AT5G50230 AT5G50380 AT5G51200 AT5G52990 AT5G55710 AT5G56020 AT5G57100 AT5G58430 AT5G58440 AT5G59740 AT5G63880 AT5G66380 AT5G66930 AT3G60320 AT1G14560 AT2G24020 AT3G61710 AT1G79560 AT1G79810 AT3G09030 AT2G40530 AT4G21160"
