"Enrichment FDR","Genes in list","Total genes","Functional Category","Genes"
1.86953340316087e-11,582,2538,"Phosphorus metabolic process ","AT1G01540 AT1G02880 AT1G03430 AT1G03740 AT1G04210 AT1G07110 AT1G07230 AT1G08590 AT1G08750 AT1G10700 AT1G12400 AT1G12680 AT1G13460 AT1G15570 AT1G16300 AT1G17350 AT1G18040 AT1G18340 AT1G20610 AT1G20930 AT1G24030 AT1G26160 AT1G27630 AT1G35670 AT1G44110 AT1G47230 AT1G48210 AT1G49340 AT1G49580 AT1G51170 AT1G51660 AT1G52310 AT1G52540 AT1G53050 AT1G53165 AT1G53570 AT1G53710 AT1G53720 AT1G53730 AT1G54340 AT1G55090 AT1G56140 AT1G56190 AT1G60490 AT1G60800 AT1G60810 AT1G61370 AT1G63700 AT1G65580 AT1G66750 AT1G67580 AT1G69220 AT1G70570 AT1G71830 AT1G72420 AT1G73500 AT1G75020 AT1G76040 AT1G76310 AT1G79470 AT2G01690 AT2G01820 AT2G01950 AT2G02780 AT2G04550 AT2G11520 AT2G13790 AT2G15270 AT2G16750 AT2G18250 AT2G18730 AT2G19470 AT2G20300 AT2G20850 AT2G20900 AT2G23200 AT2G23420 AT2G25760 AT2G25790 AT2G26430 AT2G26700 AT2G26760 AT2G30880 AT2G31305 AT2G32850 AT2G33255 AT2G35020 AT2G35320 AT2G35620 AT2G36350 AT2G37840 AT2G38230 AT2G38620 AT2G40330 AT2G41140 AT2G41490 AT2G41890 AT2G41970 AT2G42960 AT2G43980 AT2G44510 AT2G44530 AT2G44680 AT2G44830 AT2G48010 AT2G48030 AT3G01310 AT3G01380 AT3G01850 AT3G02870 AT3G03520 AT3G05050 AT3G07690 AT3G08850 AT3G10030 AT3G10540 AT3G10940 AT3G14270 AT3G14350 AT3G14890 AT3G16050 AT3G17420 AT3G20330 AT3G20830 AT3G23310 AT3G26700 AT3G29160 AT3G45040 AT3G45740 AT3G46290 AT3G47290 AT3G49360 AT3G49590 AT3G50530 AT3G51630 AT3G51830 AT3G51850 AT3G54180 AT3G59110 AT3G61420 AT3G63240 AT4G02120 AT4G04700 AT4G04720 AT4G04870 AT4G05200 AT4G08170 AT4G08850 AT4G09570 AT4G10730 AT4G14350 AT4G14580 AT4G15415 AT4G18940 AT4G19600 AT4G20270 AT4G21410 AT4G21670 AT4G23270 AT4G24100 AT4G26070 AT4G26100 AT4G28980 AT4G30520 AT4G30790 AT4G33240 AT4G35620 AT4G35905 AT4G36390 AT4G36940 AT4G37490 AT4G38230 AT4G39270 AT5G02800 AT5G03430 AT5G03470 AT5G03770 AT5G03830 AT5G04510 AT5G06340 AT5G06830 AT5G07920 AT5G09290 AT5G10270 AT5G10460 AT5G13160 AT5G14590 AT5G14850 AT5G15730 AT5G16000 AT5G18070 AT5G18190 AT5G19130 AT5G20050 AT5G20990 AT5G23400 AT5G25510 AT5G27620 AT5G28080 AT5G28850 AT5G28900 AT5G35460 AT5G37850 AT5G38560 AT5G40030 AT5G40610 AT5G41080 AT5G42740 AT5G42810 AT5G43080 AT5G44090 AT5G44100 AT5G44290 AT5G45190 AT5G46420 AT5G46790 AT5G47540 AT5G47760 AT5G48630 AT5G48640 AT5G54380 AT5G54390 AT5G54590 AT5G56580 AT5G56790 AT5G56890 AT5G57015 AT5G57630 AT5G58350 AT5G58700 AT5G58730 AT5G61410 AT5G62790 AT5G63610 AT5G63930 AT5G64070 AT5G64090 AT5G65530 AT5G66210 AT5G66850 AT5G66880 ATCG00470 AT1G08680 AT1G09020 AT1G10470 AT1G15110 AT1G24280 AT1G28960 AT1G80420 AT1G80950 AT2G01210 AT2G05940 AT2G14750 AT2G21410 AT2G25880 AT2G30360 AT2G31800 AT2G32710 AT2G36460 AT2G45490 AT2G46500 AT2G46580 AT3G06483 AT3G09970 AT3G14790 AT3G21630 AT3G24810 AT3G27300 AT3G45240 AT3G45640 AT4G03415 AT4G08920 AT4G11570 AT4G13160 AT4G13300 AT4G18140 AT4G22305 AT4G24740 AT4G28650 AT4G29530 AT4G31750 AT4G32660 AT4G32840 AT5G03730 AT5G22090 AT5G45800 AT5G45940 AT5G46410 AT5G52560 AT5G53580 AT5G56630 AT5G63910 AT1G01290 AT1G03030 AT1G03780 AT1G04400 AT1G05000 AT1G07570 AT1G08420 AT1G09420 AT1G09830 AT1G10210 AT1G10690 AT1G10760 AT1G10850 AT1G10900 AT1G11390 AT1G12640 AT1G13350 AT1G13640 AT1G13750 AT1G16270 AT1G17410 AT1G18160 AT1G18390 AT1G21980 AT1G22170 AT1G25320 AT1G27190 AT1G27320 AT1G30620 AT1G31230 AT1G31420 AT1G34430 AT1G36160 AT1G36280 AT1G47380 AT1G48605 AT1G49170 AT1G50030 AT1G51830 AT1G51940 AT1G53510 AT1G54130 AT1G54510 AT1G56145 AT1G62430 AT1G63430 AT1G63500 AT1G63970 AT1G66340 AT1G66430 AT1G68020 AT1G68410 AT1G71100 AT1G71410 AT1G71697 AT1G72300 AT1G72770 AT1G72880 AT1G73250 AT1G73460 AT1G73660 AT1G73980 AT1G74320 AT1G75210 AT1G78050 AT1G78590 AT1G79790 AT1G80940 AT2G01180 AT2G01830 AT2G01890 AT2G02500 AT2G02800 AT2G07180 AT2G07707 AT2G14110 AT2G16370 AT2G16790 AT2G17320 AT2G17370 AT2G17520 AT2G17930 AT2G18170 AT2G18700 AT2G22570 AT2G23080 AT2G23300 AT2G23450 AT2G24990 AT2G25620 AT2G26830 AT2G26980 AT2G27210 AT2G27340 AT2G28060 AT2G28870 AT2G28890 AT2G28960 AT2G30020 AT2G31880 AT2G31955 AT2G31970 AT2G33560 AT2G33700 AT2G35050 AT2G35840 AT2G37380 AT2G38680 AT2G38740 AT2G39110 AT2G39270 AT2G39445 AT2G40270 AT2G40730 AT2G40980 AT2G42880 AT2G45340 AT2G45590 AT2G45910 AT2G46090 AT2G46340 AT2G46920 AT3G01200 AT3G01300 AT3G01560 AT3G01640 AT3G01820 AT3G02600 AT3G02750 AT3G04580 AT3G04790 AT3G04810 AT3G05580 AT3G06200 AT3G06670 AT3G07130 AT3G07800 AT3G08590 AT3G08760 AT3G10572 AT3G11410 AT3G12200 AT3G12620 AT3G14050 AT3G14720 AT3G15095 AT3G16785 AT3G16990 AT3G17350 AT3G17770 AT3G20500 AT3G22750 AT3G23580 AT3G24030 AT3G24660 AT3G24715 AT3G25400 AT3G26900 AT3G28450 AT3G43220 AT3G45100 AT3G46400 AT3G46590 AT3G46820 AT3G47630 AT3G50520 AT3G50920 AT3G51740 AT3G52340 AT3G53570 AT3G55450 AT3G55960 AT3G56050 AT3G56100 AT3G57170 AT3G57710 AT3G58130 AT3G58640 AT3G58830 AT3G59480 AT3G59680 AT3G60180 AT3G60190 AT3G60440 AT3G60550 AT4G00300 AT4G00895 AT4G01660 AT4G03960 AT4G04040 AT4G06599 AT4G09650 AT4G09760 AT4G11830 AT4G11850 AT4G13020 AT4G15560 AT4G18440 AT4G18950 AT4G20460 AT4G20940 AT4G21540 AT4G22340 AT4G23740 AT4G23895 AT4G24500 AT4G26510 AT4G27600 AT4G28400 AT4G28706 AT4G30310 AT4G30820 AT4G31100 AT4G31110 AT4G31860 AT4G32180 AT4G33140 AT4G33920 AT4G35360 AT4G35600 AT4G36080 AT4G36810 AT4G39120 AT4G39540 AT5G01290 AT5G01810 AT5G01820 AT5G01950 AT5G02290 AT5G04540 AT5G06750 AT5G10020 AT5G10530 AT5G10930 AT5G11010 AT5G11850 AT5G13290 AT5G14210 AT5G15080 AT5G18700 AT5G19280 AT5G20840 AT5G21326 AT5G22840 AT5G24100 AT5G24270 AT5G24360 AT5G25440 AT5G26230 AT5G28290 AT5G32470 AT5G35750 AT5G37350 AT5G38280 AT5G40540 AT5G41180 AT5G42870 AT5G43020 AT5G43910 AT5G44480 AT5G46570 AT5G46850 AT5G48380 AT5G49760 AT5G49970 AT5G51290 AT5G51560 AT5G56460 AT5G57035 AT5G58380 AT5G58520 AT5G59010 AT5G60300 AT5G61760 AT5G62770 AT5G63140 AT5G63870 AT5G63980 AT5G66080 AT5G67200 AT5G67520 ATCG01010 ATMG00410 ATMG00480 AT1G48270 AT2G42080 AT3G59770 AT4G13830 AT5G58270 AT5G60760"
2.18466803101996e-11,573,2496,"Phosphate-containing compound metabolic process ","AT1G01540 AT1G02880 AT1G03430 AT1G03740 AT1G04210 AT1G07110 AT1G07230 AT1G08590 AT1G08750 AT1G10700 AT1G12400 AT1G12680 AT1G13460 AT1G15570 AT1G16300 AT1G17350 AT1G18040 AT1G18340 AT1G20610 AT1G20930 AT1G24030 AT1G26160 AT1G27630 AT1G35670 AT1G44110 AT1G47230 AT1G48210 AT1G49340 AT1G49580 AT1G51170 AT1G51660 AT1G52310 AT1G52540 AT1G53050 AT1G53165 AT1G53570 AT1G53710 AT1G53720 AT1G53730 AT1G54340 AT1G55090 AT1G56140 AT1G56190 AT1G60490 AT1G60800 AT1G60810 AT1G61370 AT1G63700 AT1G65580 AT1G66750 AT1G67580 AT1G69220 AT1G70570 AT1G71830 AT1G72420 AT1G73500 AT1G75020 AT1G76040 AT1G76310 AT1G79470 AT2G01690 AT2G01820 AT2G01950 AT2G02780 AT2G04550 AT2G11520 AT2G13790 AT2G15270 AT2G16750 AT2G18250 AT2G18730 AT2G19470 AT2G20300 AT2G20850 AT2G20900 AT2G23200 AT2G23420 AT2G25760 AT2G25790 AT2G26430 AT2G26700 AT2G26760 AT2G30880 AT2G31305 AT2G32850 AT2G33255 AT2G35320 AT2G35620 AT2G36350 AT2G37840 AT2G38230 AT2G38620 AT2G40330 AT2G41140 AT2G41490 AT2G41890 AT2G41970 AT2G42960 AT2G43980 AT2G44510 AT2G44530 AT2G44680 AT2G44830 AT2G48010 AT2G48030 AT3G01310 AT3G01380 AT3G01850 AT3G02870 AT3G03520 AT3G05050 AT3G07690 AT3G08850 AT3G10030 AT3G10540 AT3G10940 AT3G14270 AT3G14350 AT3G14890 AT3G16050 AT3G17420 AT3G20330 AT3G20830 AT3G23310 AT3G26700 AT3G29160 AT3G45040 AT3G45740 AT3G46290 AT3G47290 AT3G49360 AT3G49590 AT3G50530 AT3G51630 AT3G51830 AT3G51850 AT3G54180 AT3G59110 AT3G61420 AT3G63240 AT4G02120 AT4G04700 AT4G04720 AT4G04870 AT4G05200 AT4G08170 AT4G08850 AT4G09570 AT4G10730 AT4G14350 AT4G14580 AT4G15415 AT4G18940 AT4G19600 AT4G20270 AT4G21410 AT4G21670 AT4G23270 AT4G24100 AT4G26070 AT4G26100 AT4G28980 AT4G30520 AT4G30790 AT4G33240 AT4G35620 AT4G35905 AT4G36390 AT4G36940 AT4G37490 AT4G38230 AT4G39270 AT5G02800 AT5G03430 AT5G03470 AT5G03770 AT5G03830 AT5G04510 AT5G06340 AT5G06830 AT5G07920 AT5G09290 AT5G10270 AT5G10460 AT5G13160 AT5G14590 AT5G14850 AT5G15730 AT5G16000 AT5G18190 AT5G19130 AT5G20050 AT5G20990 AT5G23400 AT5G25510 AT5G27620 AT5G28080 AT5G28850 AT5G28900 AT5G35460 AT5G37850 AT5G38560 AT5G40030 AT5G40610 AT5G41080 AT5G42740 AT5G42810 AT5G43080 AT5G44090 AT5G44100 AT5G44290 AT5G45190 AT5G46790 AT5G47540 AT5G47760 AT5G48630 AT5G48640 AT5G54380 AT5G54390 AT5G54590 AT5G56580 AT5G56790 AT5G56890 AT5G57015 AT5G57630 AT5G58350 AT5G58700 AT5G58730 AT5G61410 AT5G62790 AT5G63610 AT5G63930 AT5G64070 AT5G64090 AT5G65530 AT5G66210 AT5G66850 AT5G66880 ATCG00470 AT1G08680 AT1G09020 AT1G10470 AT1G15110 AT1G24280 AT1G28960 AT1G80420 AT1G80950 AT2G01210 AT2G05940 AT2G14750 AT2G21410 AT2G25880 AT2G30360 AT2G31800 AT2G32710 AT2G36460 AT2G45490 AT2G46500 AT2G46580 AT3G06483 AT3G09970 AT3G21630 AT3G24810 AT3G27300 AT3G45240 AT3G45640 AT4G03415 AT4G08920 AT4G11570 AT4G13160 AT4G13300 AT4G18140 AT4G22305 AT4G24740 AT4G28650 AT4G29530 AT4G31750 AT4G32660 AT4G32840 AT5G03730 AT5G22090 AT5G45800 AT5G45940 AT5G46410 AT5G53580 AT5G56630 AT5G63910 AT1G01290 AT1G03030 AT1G03780 AT1G04400 AT1G05000 AT1G07570 AT1G08420 AT1G09420 AT1G09830 AT1G10210 AT1G10690 AT1G10760 AT1G10850 AT1G10900 AT1G11390 AT1G12640 AT1G13350 AT1G13640 AT1G13750 AT1G16270 AT1G17410 AT1G18160 AT1G18390 AT1G21980 AT1G22170 AT1G25320 AT1G27190 AT1G27320 AT1G31230 AT1G31420 AT1G34430 AT1G36160 AT1G36280 AT1G47380 AT1G48605 AT1G49170 AT1G50030 AT1G51830 AT1G51940 AT1G53510 AT1G54130 AT1G54510 AT1G56145 AT1G62430 AT1G63430 AT1G63500 AT1G63970 AT1G66340 AT1G66430 AT1G68020 AT1G68410 AT1G71100 AT1G71410 AT1G71697 AT1G72300 AT1G72770 AT1G72880 AT1G73460 AT1G73660 AT1G73980 AT1G74320 AT1G75210 AT1G78050 AT1G78590 AT1G79790 AT1G80940 AT2G01180 AT2G01830 AT2G01890 AT2G02500 AT2G02800 AT2G07180 AT2G07707 AT2G14110 AT2G16370 AT2G16790 AT2G17320 AT2G17370 AT2G17520 AT2G17930 AT2G18170 AT2G18700 AT2G22570 AT2G23080 AT2G23300 AT2G23450 AT2G24990 AT2G25620 AT2G26830 AT2G26980 AT2G27210 AT2G27340 AT2G28060 AT2G28870 AT2G28890 AT2G28960 AT2G30020 AT2G31880 AT2G31955 AT2G31970 AT2G33560 AT2G33700 AT2G35050 AT2G35840 AT2G37380 AT2G38680 AT2G38740 AT2G39110 AT2G39270 AT2G39445 AT2G40270 AT2G40730 AT2G40980 AT2G42880 AT2G45340 AT2G45590 AT2G45910 AT2G46090 AT2G46340 AT2G46920 AT3G01200 AT3G01300 AT3G01560 AT3G01640 AT3G01820 AT3G02600 AT3G02750 AT3G04580 AT3G04790 AT3G04810 AT3G05580 AT3G06200 AT3G06670 AT3G07130 AT3G07800 AT3G08590 AT3G08760 AT3G10572 AT3G11410 AT3G12200 AT3G12620 AT3G14050 AT3G14720 AT3G15095 AT3G16785 AT3G16990 AT3G17350 AT3G17770 AT3G20500 AT3G22750 AT3G23580 AT3G24030 AT3G24660 AT3G24715 AT3G25400 AT3G26900 AT3G28450 AT3G43220 AT3G45100 AT3G46400 AT3G46590 AT3G46820 AT3G47630 AT3G50520 AT3G50920 AT3G51740 AT3G52340 AT3G53570 AT3G55450 AT3G55960 AT3G56050 AT3G56100 AT3G57170 AT3G57710 AT3G58130 AT3G58640 AT3G58830 AT3G59480 AT3G59680 AT3G60180 AT3G60190 AT3G60440 AT3G60550 AT4G00300 AT4G00895 AT4G01660 AT4G03960 AT4G04040 AT4G06599 AT4G09650 AT4G09760 AT4G11830 AT4G11850 AT4G13020 AT4G15560 AT4G18440 AT4G18950 AT4G20940 AT4G21540 AT4G22340 AT4G23740 AT4G23895 AT4G24500 AT4G26510 AT4G27600 AT4G28400 AT4G28706 AT4G30310 AT4G30820 AT4G31100 AT4G31110 AT4G31860 AT4G32180 AT4G33140 AT4G33920 AT4G35360 AT4G35600 AT4G36080 AT4G36810 AT4G39120 AT4G39540 AT5G01290 AT5G01810 AT5G01820 AT5G01950 AT5G02290 AT5G04540 AT5G06750 AT5G10020 AT5G10530 AT5G10930 AT5G11010 AT5G11850 AT5G13290 AT5G14210 AT5G15080 AT5G18700 AT5G19280 AT5G20840 AT5G21326 AT5G22840 AT5G24100 AT5G24270 AT5G24360 AT5G25440 AT5G26230 AT5G28290 AT5G32470 AT5G35750 AT5G37350 AT5G38280 AT5G40540 AT5G41180 AT5G42870 AT5G43020 AT5G43910 AT5G46570 AT5G46850 AT5G48380 AT5G49760 AT5G49970 AT5G51290 AT5G51560 AT5G56460 AT5G57035 AT5G58380 AT5G58520 AT5G59010 AT5G60300 AT5G61760 AT5G62770 AT5G63140 AT5G63870 AT5G63980 AT5G66080 AT5G67200 AT5G67520 ATCG01010 ATMG00410 ATMG00480 AT1G48270 AT2G42080 AT3G59770 AT4G13830 AT5G58270 AT5G60760"
2.68953196502747e-11,460,1934,"Organelle organization ","AT1G01370 AT1G04020 AT1G04200 AT1G05520 AT1G05910 AT1G07130 AT1G07510 AT1G07980 AT1G08190 AT1G08220 AT1G08390 AT1G08620 AT1G10390 AT1G10690 AT1G12470 AT1G13210 AT1G14850 AT1G14910 AT1G15570 AT1G15660 AT1G15940 AT1G16970 AT1G17350 AT1G17500 AT1G18190 AT1G18600 AT1G20610 AT1G24190 AT1G24310 AT1G27700 AT1G28260 AT1G29400 AT1G29760 AT1G30825 AT1G30960 AT1G31360 AT1G32990 AT1G44110 AT1G47230 AT1G48240 AT1G48635 AT1G49890 AT1G50900 AT1G52370 AT1G53530 AT1G54140 AT1G54210 AT1G55490 AT1G59890 AT1G60490 AT1G61990 AT1G62730 AT1G63990 AT1G64350 AT1G64740 AT1G65470 AT1G68710 AT1G69390 AT1G70060 AT1G72420 AT1G72700 AT1G73240 AT1G73430 AT1G73790 AT1G76310 AT1G79090 AT1G79560 AT1G79950 AT1G80245 AT1G80260 AT1G80350 AT2G05120 AT2G05170 AT2G05210 AT2G06510 AT2G14120 AT2G19560 AT2G19950 AT2G22640 AT2G22720 AT2G24060 AT2G24070 AT2G24490 AT2G25880 AT2G26570 AT2G26760 AT2G28870 AT2G31270 AT2G31970 AT2G32900 AT2G33560 AT2G34050 AT2G35110 AT2G35320 AT2G36250 AT2G36740 AT2G37840 AT2G40550 AT2G41350 AT2G42890 AT2G44510 AT2G44580 AT2G45280 AT2G45700 AT3G02920 AT3G02980 AT3G03000 AT3G03060 AT3G05710 AT3G06820 AT3G07740 AT3G08980 AT3G09700 AT3G10110 AT3G10270 AT3G10650 AT3G11820 AT3G12270 AT3G12300 AT3G12810 AT3G13190 AT3G14120 AT3G15120 AT3G18524 AT3G18580 AT3G19180 AT3G19190 AT3G19510 AT3G19590 AT3G20020 AT3G20740 AT3G22270 AT3G22930 AT3G23660 AT3G24350 AT3G26680 AT3G28700 AT3G29100 AT3G43610 AT3G47690 AT3G48430 AT3G49180 AT3G49500 AT3G49590 AT3G52190 AT3G52400 AT3G57300 AT3G57350 AT3G60190 AT3G61650 AT3G61710 AT3G62770 AT3G62880 AT3G63150 AT4G00020 AT4G00990 AT4G01310 AT4G02030 AT4G02070 AT4G05190 AT4G08540 AT4G11060 AT4G14990 AT4G15410 AT4G16420 AT4G19540 AT4G20400 AT4G26470 AT4G26780 AT4G27180 AT4G27650 AT4G29940 AT4G30510 AT4G30690 AT4G30790 AT4G32620 AT4G33650 AT4G33890 AT4G35620 AT4G36580 AT4G37210 AT4G37490 AT4G40080 AT5G02560 AT5G02820 AT5G03030 AT5G03830 AT5G04240 AT5G04990 AT5G05620 AT5G05710 AT5G08020 AT5G08390 AT5G08565 AT5G09570 AT5G10400 AT5G10950 AT5G12390 AT5G14530 AT5G15600 AT5G16270 AT5G16280 AT5G16620 AT5G16800 AT5G16930 AT5G17410 AT5G19400 AT5G20200 AT5G21920 AT5G23430 AT5G24630 AT5G35520 AT5G38720 AT5G43080 AT5G45400 AT5G46910 AT5G47480 AT5G48460 AT5G48520 AT5G48720 AT5G49880 AT5G50230 AT5G51200 AT5G51340 AT5G54670 AT5G54920 AT5G55200 AT5G56290 AT5G58784 AT5G61000 AT5G61960 AT5G62500 AT5G63110 AT5G63220 AT5G66930 AT5G67270 ATCG00810 AT1G01780 AT1G49540 AT1G77300 AT2G16485 AT2G16700 AT2G17870 AT2G20190 AT2G23080 AT2G27350 AT2G45490 AT3G01460 AT3G14980 AT3G20840 AT3G25980 AT3G52280 AT4G00680 AT4G34660 AT5G09260 AT5G18190 AT5G24330 AT5G42400 AT5G51600 AT1G03780 AT1G04400 AT1G05830 AT1G08460 AT1G08600 AT1G16710 AT1G16800 AT1G17520 AT1G21610 AT1G21700 AT1G24450 AT1G32750 AT1G50410 AT1G54150 AT1G56460 AT1G57820 AT1G61040 AT1G64220 AT1G72740 AT1G73100 AT1G79000 AT1G79730 AT1G79810 AT1G80190 AT2G02090 AT2G13370 AT2G16440 AT2G17900 AT2G17930 AT2G23380 AT2G26460 AT2G26770 AT2G31900 AT2G33400 AT2G33610 AT2G33847 AT2G34150 AT2G37620 AT2G38440 AT2G44950 AT2G47620 AT3G06010 AT3G12980 AT3G19720 AT3G20010 AT3G21400 AT3G21820 AT3G22590 AT3G22990 AT3G24010 AT3G24880 AT3G27070 AT3G27530 AT3G33520 AT3G43220 AT3G47460 AT3G48150 AT3G48360 AT3G49560 AT3G49850 AT3G54350 AT3G60830 AT4G02020 AT4G14147 AT4G16444 AT4G17220 AT4G18600 AT4G19020 AT4G28710 AT4G30860 AT4G31210 AT4G33200 AT4G34430 AT4G36080 AT4G37610 AT5G04320 AT5G04670 AT5G04940 AT5G10710 AT5G15920 AT5G17550 AT5G18920 AT5G20610 AT5G20840 AT5G39550 AT5G40530 AT5G40930 AT5G44040 AT5G44635 AT5G48600 AT5G49160 AT5G51230 AT5G53280 AT5G55510 AT5G61060 AT5G61140 AT5G62410 AT5G63135 AT5G63160 AT5G64610 AT5G66750 AT5G67480 AT5G67580 AT1G20910 AT1G71830 AT1G76510 AT1G77220 AT2G17410 AT3G13360 AT3G14270 AT3G50960 AT3G63270 AT4G00630 AT4G33240 AT4G38360 AT5G03470 AT5G10490 AT5G19390 AT5G56210 AT1G03060 AT1G04300 AT1G04770 AT1G05180 AT1G09020 AT1G14350 AT1G15130 AT1G15215 AT1G22950 AT1G25580 AT1G32500 AT1G44000 AT1G49510 AT1G53510 AT1G54440 AT1G65260 AT1G67360 AT1G79850 AT2G01110 AT2G01690 AT2G22370 AT2G28620 AT2G33460 AT2G33800 AT2G35940 AT2G43410 AT2G46340 AT2G47940 AT3G03810 AT3G04340 AT3G10480 AT3G10490 AT3G10670 AT3G14190 AT3G15950 AT3G18420 AT3G19220 AT3G20540 AT3G24440 AT3G26900 AT3G46740 AT3G52250 AT3G55005 AT3G58040 AT3G62800 AT4G05440 AT4G05520 AT4G10620 AT4G10790 AT4G17410 AT4G22260 AT4G31010 AT4G36630 AT5G04290 AT5G04920 AT5G09420 AT5G11530 AT5G12130 AT5G13610 AT5G16490 AT5G18410 AT5G18700 AT5G19540 AT5G22010 AT5G22350 AT5G22640 AT5G24020 AT5G24314 AT5G26742 AT5G39500 AT5G48030 AT5G53860 AT5G56580 AT5G58270 AT2G03500 AT2G46180 AT5G02200 AT5G45330 AT1G05560 AT3G54860 AT5G13820 AT5G46280"
3.05063423462483e-11,790,3619,"Cellular component organization or biogenesis ","AT1G01370 AT1G04020 AT1G04200 AT1G05520 AT1G05780 AT1G05910 AT1G07130 AT1G07510 AT1G07980 AT1G08190 AT1G08220 AT1G08390 AT1G08620 AT1G09100 AT1G10180 AT1G10390 AT1G10690 AT1G12400 AT1G12470 AT1G13120 AT1G13210 AT1G14850 AT1G14910 AT1G15570 AT1G15660 AT1G15940 AT1G16970 AT1G17350 AT1G17500 AT1G18190 AT1G18600 AT1G19430 AT1G20610 AT1G21660 AT1G24190 AT1G24310 AT1G27600 AT1G27700 AT1G27930 AT1G28260 AT1G29400 AT1G29760 AT1G29890 AT1G30450 AT1G30825 AT1G30960 AT1G31360 AT1G32990 AT1G44110 AT1G47230 AT1G48240 AT1G48635 AT1G49890 AT1G50900 AT1G51390 AT1G52370 AT1G53530 AT1G53780 AT1G54140 AT1G54210 AT1G54380 AT1G54385 AT1G55490 AT1G59890 AT1G60490 AT1G61990 AT1G62730 AT1G63810 AT1G63990 AT1G64350 AT1G64740 AT1G65470 AT1G68710 AT1G69390 AT1G70060 AT1G71350 AT1G72420 AT1G72700 AT1G73240 AT1G73430 AT1G73790 AT1G74970 AT1G75310 AT1G76310 AT1G76850 AT1G78240 AT1G79090 AT1G79560 AT1G79950 AT1G80245 AT1G80260 AT1G80350 AT2G02560 AT2G04940 AT2G05120 AT2G05170 AT2G05210 AT2G06510 AT2G14120 AT2G17510 AT2G19560 AT2G19950 AT2G22640 AT2G22720 AT2G24060 AT2G24070 AT2G24490 AT2G25355 AT2G25880 AT2G26570 AT2G26760 AT2G28870 AT2G29500 AT2G29580 AT2G31270 AT2G31970 AT2G32600 AT2G32850 AT2G32900 AT2G33560 AT2G34050 AT2G34410 AT2G35110 AT2G35320 AT2G36250 AT2G36740 AT2G37090 AT2G37220 AT2G37840 AT2G39670 AT2G39750 AT2G40550 AT2G41350 AT2G42650 AT2G42890 AT2G44510 AT2G44580 AT2G45280 AT2G45700 AT2G46930 AT3G01610 AT3G02920 AT3G02980 AT3G03000 AT3G03060 AT3G03340 AT3G03773 AT3G05710 AT3G06550 AT3G06820 AT3G07740 AT3G07750 AT3G08850 AT3G08980 AT3G09360 AT3G09410 AT3G09700 AT3G10110 AT3G10270 AT3G10650 AT3G11820 AT3G12270 AT3G12300 AT3G12810 AT3G12930 AT3G12990 AT3G13190 AT3G14120 AT3G15120 AT3G18524 AT3G18580 AT3G18790 AT3G19180 AT3G19190 AT3G19510 AT3G19590 AT3G20020 AT3G20740 AT3G20970 AT3G22270 AT3G22590 AT3G22930 AT3G23660 AT3G24350 AT3G26618 AT3G26680 AT3G27530 AT3G28700 AT3G29100 AT3G43230 AT3G43610 AT3G47690 AT3G48430 AT3G49180 AT3G49500 AT3G49590 AT3G50845 AT3G51890 AT3G52150 AT3G52190 AT3G52380 AT3G52400 AT3G57300 AT3G57350 AT3G57940 AT3G60190 AT3G61650 AT3G61710 AT3G62060 AT3G62770 AT3G62880 AT3G63150 AT4G00020 AT4G00990 AT4G01310 AT4G02030 AT4G02070 AT4G02980 AT4G03430 AT4G05190 AT4G08540 AT4G09990 AT4G10620 AT4G11060 AT4G12130 AT4G12770 AT4G12780 AT4G14360 AT4G14990 AT4G15410 AT4G16420 AT4G19120 AT4G19540 AT4G20280 AT4G20400 AT4G23640 AT4G26470 AT4G26600 AT4G26780 AT4G27010 AT4G27060 AT4G27180 AT4G27650 AT4G29940 AT4G30510 AT4G30690 AT4G30790 AT4G31420 AT4G32175 AT4G32620 AT4G33650 AT4G33890 AT4G35620 AT4G36580 AT4G37210 AT4G37490 AT4G39160 AT4G39350 AT4G39670 AT4G40080 AT5G02560 AT5G02820 AT5G03030 AT5G03830 AT5G03905 AT5G04240 AT5G04930 AT5G04990 AT5G05620 AT5G05680 AT5G05710 AT5G06050 AT5G06200 AT5G07630 AT5G08020 AT5G08390 AT5G08565 AT5G09570 AT5G10070 AT5G10400 AT5G10910 AT5G10950 AT5G11010 AT5G12220 AT5G12390 AT5G14530 AT5G15600 AT5G15630 AT5G15680 AT5G16270 AT5G16280 AT5G16620 AT5G16800 AT5G16910 AT5G16930 AT5G17410 AT5G17440 AT5G17930 AT5G18410 AT5G19030 AT5G19400 AT5G20200 AT5G21920 AT5G22840 AT5G23430 AT5G24630 AT5G26670 AT5G28740 AT5G35520 AT5G38720 AT5G43080 AT5G43720 AT5G44030 AT5G44240 AT5G45400 AT5G46910 AT5G47480 AT5G47880 AT5G48460 AT5G48520 AT5G48720 AT5G49880 AT5G50230 AT5G51200 AT5G51340 AT5G51410 AT5G54670 AT5G54920 AT5G55100 AT5G55200 AT5G56090 AT5G56290 AT5G57280 AT5G57950 AT5G58784 AT5G59460 AT5G60490 AT5G61000 AT5G61960 AT5G62500 AT5G63110 AT5G63220 AT5G64020 AT5G66930 AT5G67270 ATCG00810 AT1G01780 AT1G08490 AT1G32500 AT1G48320 AT1G49540 AT1G77130 AT1G77300 AT2G16485 AT2G16700 AT2G17870 AT2G20190 AT2G22370 AT2G23080 AT2G27350 AT2G45490 AT3G01460 AT3G14980 AT3G17880 AT3G20840 AT3G25980 AT3G52280 AT3G55990 AT4G00680 AT4G05520 AT4G08920 AT4G13510 AT4G15920 AT4G28730 AT4G34660 AT5G09260 AT5G18190 AT5G24330 AT5G42400 AT5G51600 AT5G60300 AT1G02720 AT1G03780 AT1G04400 AT1G05650 AT1G05660 AT1G05830 AT1G06780 AT1G08460 AT1G08600 AT1G12040 AT1G12560 AT1G14020 AT1G14080 AT1G15220 AT1G16340 AT1G16710 AT1G16800 AT1G17520 AT1G18580 AT1G19170 AT1G19300 AT1G21610 AT1G21700 AT1G23480 AT1G24170 AT1G24450 AT1G27440 AT1G29060 AT1G30240 AT1G30620 AT1G32750 AT1G32860 AT1G48930 AT1G50410 AT1G51380 AT1G53830 AT1G54150 AT1G55150 AT1G56460 AT1G57820 AT1G61040 AT1G62440 AT1G62850 AT1G63270 AT1G64220 AT1G64390 AT1G64440 AT1G69530 AT1G70090 AT1G71990 AT1G72740 AT1G73100 AT1G73960 AT1G79000 AT1G79450 AT1G79730 AT1G79810 AT1G80190 AT2G01640 AT2G01850 AT2G02090 AT2G03220 AT2G13370 AT2G14285 AT2G15880 AT2G16440 AT2G17900 AT2G17930 AT2G23380 AT2G24240 AT2G26460 AT2G26770 AT2G26780 AT2G27500 AT2G28950 AT2G31900 AT2G33400 AT2G33610 AT2G33847 AT2G34150 AT2G35650 AT2G36850 AT2G37620 AT2G38440 AT2G38650 AT2G39700 AT2G44950 AT2G45220 AT2G46290 AT2G47620 AT2G47990 AT3G01040 AT3G02170 AT3G03220 AT3G06010 AT3G06770 AT3G09030 AT3G09090 AT3G10330 AT3G10380 AT3G10720 AT3G12980 AT3G15080 AT3G15180 AT3G19720 AT3G20010 AT3G21190 AT3G21400 AT3G21820 AT3G22800 AT3G22990 AT3G24010 AT3G24880 AT3G27070 AT3G28180 AT3G29090 AT3G33520 AT3G42950 AT3G43220 AT3G43270 AT3G47460 AT3G48150 AT3G48360 AT3G49220 AT3G49560 AT3G49850 AT3G54350 AT3G57660 AT3G59100 AT3G60830 AT3G61490 AT3G62110 AT3G63430 AT4G02020 AT4G02400 AT4G03550 AT4G04970 AT4G05410 AT4G14147 AT4G14600 AT4G16120 AT4G16444 AT4G17220 AT4G18600 AT4G19020 AT4G20170 AT4G20460 AT4G22285 AT4G22350 AT4G23820 AT4G25810 AT4G25820 AT4G28710 AT4G29360 AT4G30270 AT4G30290 AT4G30860 AT4G31210 AT4G33200 AT4G34430 AT4G36080 AT4G37610 AT4G38210 AT4G38270 AT5G03760 AT5G04320 AT5G04670 AT5G04940 AT5G06000 AT5G06640 AT5G08380 AT5G10710 AT5G13870 AT5G14550 AT5G14580 AT5G15470 AT5G15920 AT5G16190 AT5G17550 AT5G18920 AT5G20610 AT5G20840 AT5G22940 AT5G24450 AT5G25830 AT5G26742 AT5G39550 AT5G40530 AT5G40930 AT5G43130 AT5G44040 AT5G44480 AT5G44635 AT5G46150 AT5G46420 AT5G47820 AT5G48600 AT5G49160 AT5G51230 AT5G53280 AT5G54690 AT5G55000 AT5G55480 AT5G55510 AT5G56590 AT5G58480 AT5G61060 AT5G61140 AT5G62410 AT5G63120 AT5G63135 AT5G63140 AT5G63160 AT5G64610 AT5G66750 AT5G67480 AT5G67580 ATMG00180 AT1G20910 AT1G48550 AT1G55140 AT1G71830 AT1G76510 AT1G77220 AT2G02970 AT2G17410 AT2G40320 AT3G05580 AT3G13360 AT3G13740 AT3G14270 AT3G46290 AT3G50960 AT3G63270 AT4G00630 AT4G15415 AT4G19180 AT4G33240 AT4G38350 AT4G38360 AT5G03220 AT5G03470 AT5G10490 AT5G19390 AT5G54380 AT5G56210 AT5G64070 AT1G03060 AT1G04300 AT1G04770 AT1G05180 AT1G06190 AT1G07410 AT1G09020 AT1G13980 AT1G14350 AT1G15130 AT1G15215 AT1G16280 AT1G22950 AT1G25580 AT1G31420 AT1G33280 AT1G35670 AT1G44000 AT1G48380 AT1G49510 AT1G50030 AT1G53510 AT1G54440 AT1G54490 AT1G55350 AT1G56580 AT1G58250 AT1G60420 AT1G65260 AT1G66340 AT1G67360 AT1G69220 AT1G71230 AT1G72300 AT1G79850 AT2G01110 AT2G01690 AT2G02480 AT2G04550 AT2G20370 AT2G20610 AT2G21385 AT2G21410 AT2G22330 AT2G27460 AT2G28620 AT2G33460 AT2G33800 AT2G35620 AT2G35940 AT2G40190 AT2G41970 AT2G42080 AT2G43410 AT2G46340 AT2G46710 AT2G47940 AT3G02242 AT3G03810 AT3G04340 AT3G05210 AT3G05330 AT3G10480 AT3G10490 AT3G10670 AT3G12400 AT3G12977 AT3G14190 AT3G15095 AT3G15380 AT3G15950 AT3G16270 AT3G18420 AT3G19220 AT3G19770 AT3G20540 AT3G23980 AT3G24440 AT3G26900 AT3G45100 AT3G46740 AT3G48820 AT3G50660 AT3G51050 AT3G52250 AT3G54010 AT3G54180 AT3G55005 AT3G58040 AT3G60370 AT3G62800 AT4G00730 AT4G02270 AT4G02350 AT4G05440 AT4G09730 AT4G10790 AT4G17410 AT4G18800 AT4G19600 AT4G20780 AT4G22260 AT4G26430 AT4G28370 AT4G31010 AT4G31560 AT4G35760 AT4G36630 AT4G39990 AT5G01620 AT5G03280 AT5G04290 AT5G04920 AT5G09420 AT5G11530 AT5G12130 AT5G13610 AT5G13650 AT5G16490 AT5G18700 AT5G19540 AT5G20350 AT5G20820 AT5G22010 AT5G22350 AT5G22640 AT5G24020 AT5G24314 AT5G39500 AT5G44070 AT5G45190 AT5G48030 AT5G53860 AT5G54440 AT5G56580 AT5G58100 AT5G58270 AT5G61900 AT5G64340 AT5G64930 AT5G65270 AT5G65530 AT1G18850 AT2G03500 AT4G14570 AT5G11240 AT5G55630 AT1G62740 AT2G20650 AT2G46180 AT4G12400 AT4G29530 AT5G02200 AT5G45330 AT1G05560 AT3G01640 AT3G54860 AT4G04340 AT4G34980 AT5G07880 AT5G13820 AT5G46280"
